term,definition,disciplines,url
machine learning (ml),[Digital] Machine learning is a subset of AI that focuses on training models to recognize patterns and make predictions from data and can improve their performance over time without being explicitly programmed. Relevance to business: ML improves analysis and interpretation of data for operational efficiency and predictive capabilities.,Digital,https://glossary.slb.com/en/terms/m/machine_learning
machine learning operations (ml ops),"[Digital] Machine learning operations (MLOps) is the discipline of streamlining and automating the life cycle of machine learning models from development and deployment to monitoring and maintenance ensuring they remain reliable, scalable, and aligned with business goals. Relevance to business: MLOps accelerate time-to-value from AI investments, transforming AI from a proof-of-concept (POC) into a production-grade capability. They ensure that AI solutions are scalable, reliable, and continuously improved through automation and collaboration.",Digital,https://glossary.slb.com/en/terms/m/machine_learning_operations
model context protocol (mcp),"[Digital] In AI, model context protocol (MCP) is an open-source standard that allows large language models (LLMs) to securely connect with external data, tools, and applications, acting as a universal ""API for AI"" to give models real-time information and actions beyond their training data, enabling more powerful, autonomous AI agents. Relevance to business: MCP Makes AI more dynamic, enabling: Access to real-time data—connecting to live data sources for up-to-date answers. Action-taking—enables AI to perform tasks like booking appointments or updating records. Simplified development—offers a consistent way for developers to build powerful AI applications. Industry adoption—it is a standard, with support from major players like Google Cloud and Cloudflare.",Digital,https://glossary.slb.com/en/terms/m/model_context_protocol
model drift,"[Digital] Model drift is the phenomenon where a deployed AI model’s performance degrades over time due to changes in underlying data patterns or external conditions not present in the training data. Relevance to business: Monitoring and managing model drift is essential for maintaining accuracy, reducing risks, and ensuring that AI-driven decisions remain reliable as business environments evolve.",Digital,https://glossary.slb.com/en/terms/m/model_drift
Model management,"[Digital] Model management is the comprehensive process of tracking, versioning, deploying, monitoring, and maintaining machine learning models throughout their life cycle. Relevance to business: Model management ensures efficient, compliant, and scalable AI operations by enabling rapid model updates, consistent performance, and governance across the enterprise.",Digital,https://glossary.slb.com/en/terms/m/model_management
multi-agent system (mas),"[Digital] A multi-agent system is a framework where multiple AI agents work together to solve complex problems or tasks. Relevance to business: MAS are used in complex simulations and coordination tasks. Frequently, they are used through distributed AI platforms and coordination algorithms, in businesses such as robotics, supply chain optimization, or complex decision-making environments.",Digital,https://glossary.slb.com/en/terms/m/multi_agent_system
multimodal models,"[Digital] Multimodal models are AI models that are designed to process and integrate multiple types of data, such as text, images, audio and video. Relevance to business: Multimodal modals enable AI to interpret complex real-world information in a more human-like manner. Used in applications, such as enhanced customer interaction and autonomous vehicles.",Digital,https://glossary.slb.com/en/terms/m/multimodal_models
neural network,"[Reservoir Characterization, Digital] A concept for advanced computer calculations developed by Alan Turing to mimic some of the operations of the neurons in a brain. Memory elements (neurons) are conceptually interconnected by multiple paths connected with on-off switches to emulate the synapses of the brain. The original intent was to build a data-processing machine. Modern applications reduce the concept to structured digital software processing models. Repeated processing through a neural network allows the network to learn from the data it processes. The learned process obtained from a set of training data with solutions can then be applied to other data sets for which no solution exists. An oilfield example includes training a network with wireline log and core data and then using the network to interpret further log data in terms of the core data. Neural networks are also being used in seismic processing, geological mapping and petrophysical analysis.","Reservoir Characterization, Digital",https://glossary.slb.com/en/terms/n/neural_network
open source,"[Digital] Open source refers to software with publicly available source code. The code is freely available for anyone to view, modify, and distribute. Relevance to business: Open source is central to widely used technologies such as Python libraries (e.g., TensorFlow, PyTorch), operating systems (e.g., Linux), and platforms (e.g., Kubernetes). It can help reduce development costs, accelerate time-to-market, and access a global ecosystem of innovation and community support.",Digital,https://glossary.slb.com/en/terms/o/open_source
orchestration,"[Digital] Orchestration refers to coordinating multiple AI models, data pipelines, or services to work together efficiently. Relevance to business: Orchestration ensures scalable, reliable AI workflows across departments or systems to manage model versioning, resource allocation, and continuous integration/continuous deployment (CI/CD).",Digital,https://glossary.slb.com/en/terms/o/orchestration
parameters,"[Digital] Parameters are internal values in a model learned from data to determine its behavior. Relevance to business: Having more parameters often means models are more powerful and deliver more accurate forecasting, better automation, and improved decision support, but also higher cost and complexity.",Digital,https://glossary.slb.com/en/terms/p/parameters
physics-informed ai,"[Digital] Physics-informed AI models incorporate physical laws or domain-specific equations into their learning process. Relevance to business: Physics-informed AI is used in scientific and industrial applications to deliver hybrid solutions to offer smarter, safer, and faster decision making in complex systems—reducing risk, optimizing performance, and improving ROI by bridging the gap between traditional engineering and modern AI.",Digital,https://glossary.slb.com/en/terms/p/physics_informed_ai
predictive ai,"[Digital] Predictive AI systems analyze historical and real-time data to forecast future outcomes, trends, or behaviors. Relevance to business: Predictive AI enables proactive decision making in response to changing markets or operating conditions, such as equipment maintenance, market demand, or customer behavior.",Digital,https://glossary.slb.com/en/terms/p/predictive_ai
private cloud,"[Digital] Private cloud is a cloud computing environment that is dedicated to a single organization, offering cloud-like scalability and automation while retaining control over infrastructure, data governance, and security. Relevance to business: Private cloud delivers the flexibility of cloud-native AI development, while ensuring compliance with data residency, IP protection, and integration into existing operational environments—especially valuable in regulated or high-stakes industrial sectors.",Digital,https://glossary.slb.com/en/terms/p/private_cloud
prompt,"[Digital] Prompt refers to an input or instruction given to a generative AI model (such as a large language model) to guide its output, often in the form of a question, statement, or task description. Relevance to business: Prompts enables users to interact with AI systems more naturally and flexibly, unlocking productivity, creativity, and automation in content creation, customer support, and data analysis.",Digital,https://glossary.slb.com/en/terms/p/prompt
prompt engineering,"[Digital] Crafting and refining inputs to guide the behavior and output quality of large language models (LLMs) and other generative AI systems is known as prompt engineering. Relevance to business: Prompt engineering improves the relevance, accuracy, performance, and reliability of AI outputs, improving productivity and trust in AI-assisted decision-making.",Digital,https://glossary.slb.com/en/terms/p/prompt_engineering
public cloud,"[Digital] Public cloud refers to shared, on-demand computing resources like AWS, Microsoft Azure, or Google Cloud. It offers scalable infrastructure and advanced AI services without the need for businesses to manage the underlying hardware. Importantly, while infrastructure is shared, each company’s data and workloads are securely isolated through robust encryption, access controls, and compliance frameworks built into the platform. Relevance to business: Public cloud enables rapid experimentation, faster time to value, and elastic scale for AI workloads—particularly beneficial for innovation-driven use cases, global collaboration, and when internal IT capacity is limited.",Digital,https://glossary.slb.com/en/terms/p/public_cloud
reinforcement learning,"[Digital] Reinforcement learning refers to learning methods where AI improves by trial and error, guided by rewards. Relevance to business: Reinforcement learning is particularly useful in complex, dynamic environments where the optimal strategy isn’t known in advance. It is useful in optimization problems like logistics, control systems, and robot process automation.",Digital,https://glossary.slb.com/en/terms/r/reinforcement_learning
responsible ai,"[Digital] Responsible AI is the practice of developing, designing, and deploying AI systems in a way that is ethical, transparent, and aligned with legal, corporate, or societal values. Relevance to business: Through governance frameworks and other control and monitoring practices responsible AI ensures fairness, accountability, compliance and trust for customers, regulators and other stakeholders in the output of AI solutions.",Digital,https://glossary.slb.com/en/terms/r/responsible_ai
retrieval augmented generation (rag),"[Digital] Retrieval-augmented generation is AI architecture that combines generative models (like large language models) with real-time access to external knowledge sources, such as databases or document repositories. Relevance to business: RAG retrieves additional relevant context from proprietary or specialist data sources. Its value lies in reducing hallucinations, improving trust and compliance, and enabling AI systems to deliver precise, data-grounded answers, thereby enhancing productivity and decision quality.",Digital,https://glossary.slb.com/en/terms/r/retrieval_augmented_generation
sentiment analysis,"[Digital] Sentiment analysis is the process of detecting emotions, opinions, or attitudes expressed in text data, e.g. social media, newsfeeds, articles or other communications. Relevance to business: Sentiment analysis is frequently used to help understand customer feedback, brand perception, and market trends.",Digital,https://glossary.slb.com/en/terms/s/sentiment_analysis
software as a service (saas),"[Digital] Software as a service (SaaS) refers to software applications delivered over the internet on a subscription basis, eliminating the need for businesses to install, manage, or maintain software on their own infrastructure. It typically appears as cloud-hosted applications accessible via web browsers or APIs, built on scalable cloud platforms, and integrated with services like identity management, data analytics, and automated updates. Relevance to business: SaaS offers rapid deployment, lower upfront costs, seamless scalability, and continuous innovation, enabling teams to focus on core activities while benefiting from secure, always-up-to-date software solutions.",Digital,https://glossary.slb.com/en/terms/s/software_as_a_service
sovereign cloud,"[Digital] Sovereign cloud is a cloud environment architected to ensure that all data, operations, and access are governed entirely under the legal and regulatory frameworks of a specific nation or region—protecting against foreign jurisdiction or extraterritorial access. It typically manifests through cloud infrastructure operated by a local provider or in partnership with a global hyperscaler (e.g. AWS, Azure, Google) under strict legal and technical controls, and includes services like secure data storage, AI model development, and analytics, all performed within the jurisdiction. Relevance to business: For B2B businesses, especially in regulated or strategic sectors, a sovereign cloud provides the benefits of cloud-based AI, while ensuring compliance with local data sovereignty requirements, mitigating the risk of foreign access or regulatory disputes and conflicts.",Digital,https://glossary.slb.com/en/terms/s/sovereign_cloud
supervised learning,"[Digital] Supervised learning is machine learning trained on labeled data—meaning the input data is paired with the correct output—so the system learns to make accurate predictions or classifications from new, unseen data. Relevance to business: Supervised learning is used in classification, forecasting and data interpretation, it adds value by automating high-volume, repeatable tasks, and improving decision accuracy—ultimately increasing efficiency and reducing operational risk.",Digital,https://glossary.slb.com/en/terms/s/supervised_learning
synthetic data,"[Digital] Synthetic data is artificially generated data that mimics real-world data, created using algorithms or simulations rather than being collected from actual events or users. Relevance to business: Enables safe model training without exposing sensitive information, reduces data collection costs, and allows for rapid prototyping and testing where real data is limited or unavailable.",Digital,https://glossary.slb.com/en/terms/s/synthetic_data
token,"[Digital] A token is a unit of text used in large language models (LLMs), or a predefined amount of resource usage, service consumption, or functionality access. Relevance to business: For AI applications, understanding tokens is critical for managing model costs (which are often calculated per token), optimizing performance, and ensuring AI tools deliver accurate, contextually relevant results.",Digital,https://glossary.slb.com/en/terms/t/token
training data,"[Digital] Training data is used to teach AI models how to recognize patterns, make predictions, or generate outputs. Relevance to business: Relevant, high quality training data improves model accuracy and reliability. It is a critical asset for building AI tools that solve industry-specific problems, improve automation, and drive competitive differentiation.",Digital,https://glossary.slb.com/en/terms/t/training_data
transfer learning,"[Digital] Transfer learning is reusing or adapting a pre-trained model on a new, but related task—leveraging pre-learned knowledge to reduce the need for large amounts of new data and training time. Relevance to business: Transfer learning speeds up development and improves performance with less data helping to accelerate AI adoption, reduce development costs, and improve model performance on specialized tasks, enabling faster deployment of insights and automation across operations.",Digital,https://glossary.slb.com/en/terms/t/transfer_learning
transformer model,"[Digital] A transformer model is a type of deep learning architecture that excels at understanding and generating sequential data, such as language, by using mechanisms called ‘attention’ to weigh the importance of different input elements. Relevance to business: Transfer models power modern natural language processor (NLP) models like GPT (Generative Pre-trained Transformers) and enable organizations to unlock scalable automation of complex, knowledge intensive tasks.",Digital,https://glossary.slb.com/en/terms/t/transformer_model
unsupervised learning,"[Digital] Unsupervised learning in AI refers to training models to identify patterns, structures, or relationships in data without relying on labeled examples. It is typically found in clustering, anomaly detection, dimensionality reduction, and pattern discovery tools, often embedded in analytics platforms, recommendation engines, or predictive maintenance systems. Relevance to business: Unsupervised learning is used in clustering, anomaly detection, and pattern discovery, it provides the ability to uncover novel insights, detect emerging risks or opportunities, and optimize operations without the need for extensive labeled datasets.",Digital,https://glossary.slb.com/en/terms/u/unsupervised_learning
validation data,"[Digital] Validation data refers to a separate dataset that is used to evaluate and fine-tune a model’s performance during training. Relevance to business: Validation data ensures the model generalizes well and avoids overfitting (where a model performs well on training data, but poorly on new data due to its inability to generalize).",Digital,https://glossary.slb.com/en/terms/v/validation_data
zero shot,"[Digital] Zero-shot learning in AI is the ability of a model to perform a task or make predictions on data it has never seen before, without requiring task-specific training. Commonly used in large language models, classification tools, or recommendation systems to understand new prompts, categories, or contexts on the fly. Relevance to business: Zero shot enables rapid and flexible deployment of AI solutions for varied use cases and at low-cost, extending AI capabilities to new products, markets, or datasets without costly retraining; however, it may lack the business specific insights of more advanced models.",Digital,https://glossary.slb.com/en/terms/z/zero_shot
