term,definition,disciplines,url
adversarial attack,"[Digital] An adversarial attack is a technique where intentionally crafted inputs are fed to AI models to deceive or mislead them into making incorrect predictions or classifications. Relevance to business: Adversarial attacks highlights vulnerabilities in AI systems, necessitating robust security and testing to protect critical applications from exploitation, reduce risk, and ensure reliability.",Digital,https://glossary.slb.com/en/terms/a/adversarial_attack
agent-to-agent (a2a),"[Digital] Agent-to-agent, or A2A, is a paradigm where autonomous AI agents communicate and collaborate directly with each other to complete tasks, exchange information, or coordinate actions without human intervention. Relevance to business: A2A enables the creation of complex, automated business processes, reduces manual intervention, and facilitates more efficient and scalable operations in digital ecosystems.",Digital,https://glossary.slb.com/en/terms/a/agent_to_agent
agentic ai,"[Digital] Agentic AI is an advanced form of AI that can act with a high degree of autonomy—multiple AI components work together like a team, managing tasks, learning over time, and adjusting their approach, without constant human input. Instead of doing just one thing, agentic AI systems plan, coordinate, and adapt to handle more complex and changing problems—like acting as a research assistant, running diagnostics across systems, or AI-led scenario planning. Relevance to business: Agentic AI holds transformative value by unlocking scalable decision making and adaptive workflows that would otherwise require teams of specialists. See how it works: Tela™ agentic-AI assistant built for energy",Digital,https://glossary.slb.com/en/terms/a/agentic_ai
ai accelerator,"[Digital] An AI accelerator is a tool, program, or initiative designed to speed up the adoption of AI technologies. Relevance to business: An AI accelerator helps reduce time-to-value by providing reusable components, frameworks, pre-trained models, specific hardware, e.g. graphics processing unit (GPU), best practices, and other solutions that can jump-start AI initiatives.",Digital,https://glossary.slb.com/en/terms/a/ai_accelerator
ai agent,"[Digital] An AI agent is a modular software tool—typically powered by large language or image models—that is designed to perform narrow, well-defined tasks, such as summarizing documents, extracting data, or automating customer responses. These agents often rely on tool integrations, prompt engineering, and basic reasoning chains to accomplish their objectives within constrained workflows. Relevance to business: AI agents can automate decision-making processes, reducing the need for human intervention during routine or high frequency tasks, like knowledge management, support ticket triage, and operational reporting.",Digital,https://glossary.slb.com/en/terms/a/ai_agent
ai ethics,"[Digital] AI ethics are principles guiding responsible design, development, and use of AI. Relevance to business: Ethical principles engender trust and accountability with customers, partners, and regulators by ensuring AI solutions are transparent, fair, and compliant with emerging standards. They also reduce legal and reputational risks.",Digital,https://glossary.slb.com/en/terms/a/ai_ethics
algorithm,"[Digital] An algorithm is a set of rules or instructions for solving problems. Relevance to business: Algorithms enable companies to process large volumes of data efficiently, and drives decision making and automation in AI systems.",Digital,https://glossary.slb.com/en/terms/a/algorithm
algorithmic bias,"[Digital] Algorithmic bias refers to bias in AI outcomes due to biased training data or design. Relevance to business: Algorithmic bias can lead to decisions that unintentionally favor or disadvantage certain groups or outcomes. Important for fairness, regulatory compliance, and company reputation.",Digital,https://glossary.slb.com/en/terms/a/algorithmic_bias
alignment,"[Digital] Alignment ensures that an AI system’s objectives, outputs, and behaviors are consistent with the values, goals, and risk tolerances of the business using it. Relevance to business: Alignment is critical for trust, regulatory compliance, and operational reliability, to ensure safe and beneficial AI deployment. Technologies and services such as model fine-tuning, human-in-the-loop feedback loops, safety guardrails, domain-specific training data, and governance frameworks are employed to keep AI decisions transparent and predictable.",Digital,https://glossary.slb.com/en/terms/a/alignment
application programming interface (API),"[Digital] An application programming interface, more commonly known by its initialism, API, is a set of computer protocols and tools that allow different software applications and systems to communicate. Relevance to business: APIs enable faster deployment and innovation by connecting disparate systems, automating workflows, and extending capabilities with partner ecosystems. See related Insights Articles: Digital supply chain cybersecurity in oil and gas",Digital,https://glossary.slb.com/en/terms/a/application_programming_interface
artificial general intelligence (AGI),"[Digital] AI with human-level cognitive capabilities is known as artificial general intelligence or AGI. It is important to note that this technology is conceptual and there is intense debate over if and when early forms of AGI may be officially recognized. Relevance to business: If successfully developed, AGI would perform routine tasks and human-level cognitive tasks, such as research and strategic planning, leading to higher efficiency and cost reduction.",Digital,https://glossary.slb.com/en/terms/a/artificial_general_intelligence
artificial intelligence,"[Digital] Artificial intelligence is a computer system that simulates human intelligence. AI can take many forms, including: Predictive AI (also known as machine learning)—uses data to make forecasts or classifications. Generative AI—creates new content such as text, images, or code. Agentic AI—acts autonomously to plan and execute tasks to achieve goals. Relevance to business: AI is used in automation, decision making, and predictive analytics solutions. It can increase business efficiency, help reduce cost, improve the speed and quality of decision making, and increase a company’s competitive advantage.",Digital,https://glossary.slb.com/en/terms/a/artificial_intelligence
artificial intelligence (AI),"[Digital] Artificial intelligence is a computer system that simulates human intelligence. AI can take many forms, including: Predictive AI (also known as machine learning)—uses data to make forecasts or classifications. Generative AI—creates new content such as text, images, or code. Agentic AI—acts autonomously to plan and execute tasks to achieve goals. Relevance to business: AI is used in automation, decision making, and predictive analytics solutions. It can increase business efficiency, help reduce cost, improve the speed and quality of decision making, and increase a company’s competitive advantage.",Digital,https://glossary.slb.com/en/terms/a/artificial_intelligence
artificial superintelligence (ASI),"[Digital] ASI is a term used for AI that surpasses human intelligence. It is important to note that this technology is conceptual; it has not been developed to date. Relevance to business: Discussions about ASI are speculative, as the technology currently does not yet exist, but is important for strategic foresight.",Digital,https://glossary.slb.com/en/terms/a/artificial_superintelligence
attention mechanism,"[Digital] Attention mechanism is a technique in AI models that allows the system to focus on the most relevant parts of input data when making predictions. Relevance to business: Attention mechanism improves performance of models in tasks such as language translation, document summarization, and image captioning (leading to more accurate and context-aware AI outputs).",Digital,https://glossary.slb.com/en/terms/a/attention_mechanism
big data,"[Digital] Big data refers to large and complex datasets; they require advanced tools to analyze. Relevance to business: Using data-driven strategies, big data enables more accurate predictive analytics, better customer insights, and optimized operations.",Digital,https://glossary.slb.com/en/terms/b/big_data
chatbot,"[Digital] A chatbot is an AI system that interacts with users via text or voice. It uses natural language processing (NLP) to understand and respond to user queries in real time, often providing support, information, or task automation. Relevance to business: Chatbots enhance user or customer service and engagement. They give people and teams more time to apply their expertise to associated tasks.",Digital,https://glossary.slb.com/en/terms/c/chatbot
cloud computing,"[Digital] Cloud computing is computing resources, delivered over the internet on demand, such as servers, storage, databases, and software—enabling flexible and scalable access without owning physical infrastructure. Services range from basic compute and storage to advanced analytics and AI tools. Relevance to business: Cloud computing accelerates AI adoption by providing flexible, scalable, and cost-effective access to advanced AI infrastructure. It reduces time-to-market and enables seamless collaboration across both local and global teams and partners to drive innovation and operational agility.",Digital,https://glossary.slb.com/en/terms/c/cloud_computing
cloud service provider (CSP),"[Digital] A cloud service provider (CSP) is a company that offers cloud-based computing resources and services—such as infrastructure, platforms, or software—delivered over the internet from their regionally, or globally, distributed data centers. Relevance to business: Partnering with a CSP enables access to flexible IT infrastructure, cost optimization, faster innovation, and 24/7 availability of advanced cloud-native services without the need to manage physical hardware internally.",Digital,https://glossary.slb.com/en/terms/c/cloud_service_provider
cognitive computing,"[Digital] Cognitive computing refers to AI systems that mimic human thought processes to solve complex problems by combining multiple AI techniques, including machine learning, natural language processing, and contextual understanding. Relevance to business: Cognitive computing enhances decision making by providing deeper insights from complex data in areas like diagnostics, planning, and customer service.",Digital,https://glossary.slb.com/en/terms/c/cognitive_computing
computer vision,"[Digital] Computer vision refers to AI that interprets visual information from the world around it, such as images and video—live or prerecorded. Relevance to business: Computer vision enables automation of tasks that rely on visual inspection and surveillance. It provides actionable insights from visual data, improving decision making and creating new business opportunities.",Digital,https://glossary.slb.com/en/terms/c/computer_vision
contrastive language-image pretraining (CLIP),"[Digital] Contrastive language-image pretraining or CLIP is an AI model that learns to associate text and images by training on massive datasets of both, enabling a system to “understand” visuals in natural language terms. Relevance to business: CLIP enables image-text matching for search, tagging and content moderation using text-based queries to enhance content discovery, automate visual data interpretation, and enable more intuitive human-AI interaction - improving efficiency in design and operational intelligence workflows",Digital,https://glossary.slb.com/en/terms/c/contrastive_language-image_pretraining
convolutional neural network (CNN),"[Digital] Convolutional neural network (CNN) is a deep learning model for analyzing visual data, including images and video. Relevance to business: CNN is used in image recognition, security, health and safety monitoring, defect detection, and visual inspections in industrial and manufacturing settings.",Digital,https://glossary.slb.com/en/terms/c/convolutional_neural_network
cybersecurity,"[Digital] Cybersecurity refers to technologies and processes that protect internet-connected systems, including hardware, software, and data, from cyber threats. Relevance to business: Cybersecurity improves resilience by detecting threats earlier, reducing response times, and minimizing the risk of costly breaches. It provides scalable, proactive protection for digital assets and critical systems, supporting customer trust and regulatory compliance. See related Insights Articles: Digital supply chain cybersecurity in oil and gas",Digital,https://glossary.slb.com/en/terms/c/cybersecurity
data analytics,"[Digital] Data analytics is the process of examining large datasets to uncover insights and trends. Relevance to business: Data analytics enables more informed decisions, operational optimization, and better forecasting of market or operational trends. It drives efficiency, reduces risk, and supports innovation by turning raw data into operational or strategic intelligence.",Digital,https://glossary.slb.com/en/terms/d/data_analytics
data augmentation,"[Digital] Data augmentation is a technique to expand training data sets by modifying existing data, e.g. by altering images or generating synthetic data. Relevance to business: Data augmentation improves AI model accuracy and robustness, especially when data is limited. It can also reduce the cost of data collection, when real world data is limited or sensitive.",Digital,https://glossary.slb.com/en/terms/d/data_augmentation
data center,"[Digital] A data center is a facility that houses computing infrastructure, such as the servers, storage systems, and networking equipment used to process, store, and manage large volumes of digital data. Relevance to Business: Data centers provide secure, scalable, on-demand computing power and storage infrastructure essential for running applications, managing data, and supporting digital services.",Digital,https://glossary.slb.com/en/terms/d/data_center
data mining,"[Digital] Data mining is the process used to discover patterns and insights from large data sets. Relevance to business: Data mining drives strategic decisions by uncovering trends, anomalies, and opportunities for actionable business intelligence.",Digital,https://glossary.slb.com/en/terms/d/data_mining
deep learning,"[Digital] Deep learning is a subset of machine learning (ML), using neural networks with many layers to model complex patterns in data. Relevance to business: Deep learning is used in image recognition, speech recognition, natural language processing (NLP), and generative AI platforms. It enables automation of complex tasks to improve predictive capabilities and enhance decision making.",Digital,https://glossary.slb.com/en/terms/d/deep-learning
diffusion models,"[Digital] Generative AI models used for creating images, video, audio and other data by starting with random noise and gradually shaping it into realistic content. They are widely used to create high-quality synthetic media. Relevance to business: Diffusion models are used in tools for content creation, image and video generation. They enable business to create synthetic data, 3D models and simulations and reduce dependencies on costly or time-consuming real-world experimentation.",Digital,https://glossary.slb.com/en/terms/d/diffusion_models
digital twin,"[Digital] A digital twin is a dynamic, virtual replica of a physical system that uses sensor data to simulate real-world conditions for analysis within a digital platform. Relevance to business: Digital twins enable production and asset management to simulate and analyze real-word equipment to reduce costs and downtime and accelerate decision making relevant to maximize performance. See related Insights Articles: How project integration reduces upstream asset risk",Digital,https://glossary.slb.com/en/terms/d/digital_twin
double descent,"[Digital] Double descent is a phenomenon where model performance improves, worsens and improves again, as complexity or scale increases. Relevance to business: Double descent understanding helps guide model scaling strategies—balancing compute cost and accuracy—to achieve superior performance in predictive analytics, optimization, and decision-support systems.",Digital,https://glossary.slb.com/en/terms/d/double_descent
edge ai,"[Digital] Edge AI refers to the deployment of AI models on devices or equipment – such as sensors, controllers, or mobile hardware - located on or near the source of data generation. It typically manifests in industrial IoT systems, autonomous machinery, smart sensors, and real-time monitoring solutions that can make local decisions without network dependency. Relevance to business: Edge AI enables rapid decision making at the source of the data. It is especially useful in remote or low-connectivity environments, where signal latency or cloud availability may be an issue.",Digital,https://glossary.slb.com/en/terms/e/edge_ai
edge computing,"[Digital] Edge computing involves processing data near the data source or device, rather than in a centralized cloud. Relevance to business: Edge computing improves response time and reduces need to send large volumes of data over networks.",Digital,https://glossary.slb.com/en/terms/e/edge_computing
embedding,"[Digital] Embedding is a way to represent data (images/words/behaviors) as numerical representations that machines can understand and process. Relevance to business: Embedding powers search, recommendation systems, and semantic analysis where understanding of content or behavior is critical.",Digital,https://glossary.slb.com/en/terms/e/embedding
emergent behavior,"[Digital] Emergent behavior describes unexpected capabilities that arise when AI models reach a certain scale or complexity, enabling them to perform tasks they weren’t explicitly trained for. Relevance to business: Emergent behavior can lead to innovative applications but also requires careful monitoring and governance.",Digital,https://glossary.slb.com/en/terms/e/emergent_behavior
encryption,"[Digital] Encryption is a cybersecurity technique that protects data by converting it into a coded format that can only be deciphered with the correct cryptographic key. Relevance to business: Encryption is critical for the protection of data, intellectual property, customer trust and regulatory compliance. It reduces the financial and reputational risks associated with data breaches.",Digital,https://glossary.slb.com/en/terms/e/encryption
explaniability,"[Digital] Techniques to make AI reasoning transparent are known as explainability. Relevance to business: Explainability improves trust with customers, regulators, and internal users by providing clear insights into AI-driven decisions.",Digital,https://glossary.slb.com/en/terms/e/explaniability
foundation model,"[Digital] A foundation model is a large, general-purpose AI model pre-trained on broad data and adaptable to many tasks. These models are designed to be general-purpose and serve as the “foundation” for building customized AI applications. Relevance to business: Foundation models reduce the development time, cost, and expertise required to deploy advanced AI.",Digital,https://glossary.slb.com/en/terms/f/foundation_model
generative aI,"[Digital] Generative AI (often referred to as GenAI) is a class of artificial intelligence that creates new content, such as text, images, or code, by learning from existing data. Relevance to business: Generative AI enables organizations to automate processes, analyze and interpret complex datasets, and accelerate innovation, often mimicking human creativity and communication to deliver actionable insights faster than traditional methods or approaches.",Digital,https://glossary.slb.com/en/terms/g/generative-ai
generative pretrained transformer  (GPT),"[Digital] Generative Pretrained Transformer (GPT) is a type of large language model designed to understand and generate human-like text based on vast amounts of training data. Relevance to business: Typically deployed as chatbots, content generation tools, and natural language interfaces, a GPT enables more efficient automation of customer interactions, faster content creation, and enhanced decision support, by extracting insights from complex data.",Digital,https://glossary.slb.com/en/terms/g/generative_pretrained_transformer
guardrails,"[Digital] Guardrails are controls, policies and technologies designed to ensure safe, ethical and appropriate AI behavior within defined boundaries. Relevance to business: Guardrails are important for customer trust, regulatory and legal compliance, and risk management. They may include bias detection methods and human-in-the-loop oversight.",Digital,https://glossary.slb.com/en/terms/g/guardrails
hallucination,"[Digital] When an AI generates incorrect, false or misleading information that appears plausible but is not based on factual data, it is known as hallucination. Relevance to business: Understanding and managing hallucinations is crucial to maintaining the reliability and credibility of AI applications, especially in high-stakes areas like decision support, compliance, or customer communication. Best practices may involve validating AI outputs against trusted sources and using experts to review AI-generated content, especially in high-impact settings.",Digital,https://glossary.slb.com/en/terms/h/hallucination
high performance computing (HPC),"[Digital] High performance computing (HPC) refers to the use of powerful computing resources (CPUs and GPUs) to solve complex problems at high speed.. Relevance to business: HPC enables large-scale simulations and AI workflows. Cloud based HPC reduces barriers to entry, allowing more companies to access advanced computing without heavy infrastructure investment and up-front capex.",Digital,https://glossary.slb.com/en/terms/h/high_performance_computing_hpc
human-in-the-loop (HITL),"[Digital] Human-in-the-loop (HITL) is where human expertise is integrated into AI workflows to guide, validate, or correct the system’s outputs. Relevance to business: HITL ensures greater accountability, accuracy, and trust in AI systems by allowing human oversight, especially in high-stake decision making.",Digital,https://glossary.slb.com/en/terms/h/human_in_the_loop_hitl
hybrid cloud,"[Digital] Hybrid cloud is a computing environment that combines public cloud services and private cloud infrastructure, architected to enable seamless data and application portability across both. Relevance to business: Hybrid cloud offers the flexibility to optimize workloads by balancing control, compliance, and cost-efficiency. Combines: Scalable public cloud services from hyperscalers, with globally accessible capacity and industry-leading security. With private cloud infrastructure operated on-premises to meet specific governance, privacy, and mission-critical requirements for sensitive data. This approach enables organizations to leverage the strengths of both environments: the expansive scale and advanced security capabilities of public clouds alongside the tailored control and compliance of their own data centers.",Digital,https://glossary.slb.com/en/terms/h/hybrid_cloud
hyperparameters,[Digital] Hyperparameters are configuration settings that control how an AI model learns. Relevance to business: Tuning hyperparameters improves model performance and efficiency.,Digital,https://glossary.slb.com/en/terms/h/hyperparameters
hyperscaler,"[Digital] A hyperscaler is a large-scale cloud provider, such as Amazon Web Services (AWS), Microsoft Azure, or Google Cloud, that offers massive computing capacity, global infrastructure, and a broad suite of services to support digital workloads at virtually any scale. These capabilities are delivered through highly automated data centers, elastic compute and storage services, AI and machine learning platforms, API-driven infrastructure, and advanced tools for security, networking, and analytics. Relevance to business: For B2B businesses, partnering with a hyperscaler enables rapid innovation, global reach, and operational agility, while reducing the need for heavy upfront infrastructure investment—particularly valuable when scaling digital and AI initiatives across geographies or business units.",Digital,https://glossary.slb.com/en/terms/h/hyperscaler
image recognition,"[Digital] Image recognition is technology that enables machines to interpret and understand visual data to identify objects, people, and patterns in images and video. Relevance to business: Image recognition is used to improve operational efficiency, safety, cost saving, and real-time decision making, through automated safety monitoring, quality control, asset monitoring and surveillance.",Digital,https://glossary.slb.com/en/terms/i/image_recognition
large language model (LLM),"[Digital] A large language model is a type of AI that is trained on vast amounts of text to understand and generate human-like language, enabling it to interpret context, answer questions, and produce coherent narratives. Relevance to business: LLMs are used in chatbots, virtual assistants, document summarization and analysis. They enhance user engagement, streamline knowledge management, and accelerate decision making by turning huge volumes of unstructured text, e.g. reports and articles, into actionable insights efficiently, and at scale.",Digital,https://glossary.slb.com/en/terms/l/large_language_model_llm
