term,definition,disciplines,url
Rich-azimuth towed-streamer acquisition,[Geophysics] A marine seismic data acquisition method using one or more seismic vessels to obtain a combination of multiazimuth and wide-azimuth geometries. A rich-azimuth seismic dataset can be formed by combining the data where multiple wide-azimuth surveys intersect.,Geophysics,https://glossary.slb.com/en/terms/r/rich-azimuth_towed-streamer_acquisition
Ricker wavelet,[Geophysics] A zero-phase wavelet commonly convolved with a reflectivity trace to generate a synthetic seismogram.,Geophysics,https://glossary.slb.com/en/terms/r/ricker_wavelet
rock mechanics,"[Geophysics] The study of the physical characteristics and behavior of rock. Rock mechanics can include analysis of and relationships between properties such as velocity, density, porosity, permeability, shear strength, and bending and crushing behavior, as well as the greater geological context of forces that deform strata and produce geological structures.",Geophysics,https://glossary.slb.com/en/terms/r/rock_mechanics
root-mean-square velocity,"[Geophysics] The value of the square root of the sum of the squares of the velocity values divided by the number of values, symbolized by vrms. The root-mean-square velocity is that of a wave through subsurface layers of different interval velocity along a specific raypath, and is typically several percent higher than the average velocity. The stacking velocity and the root-mean-square velocity approach equality when source-receiver offset approaches zero and layers are horizontal and isotropic.",Geophysics,https://glossary.slb.com/en/terms/r/root-mean-square_velocity
S-wave,"[Geophysics] An elastic body wave in which particles oscillate perpendicular to the direction in which the wave propagates. S-waves are generated by most land seismic sources, but not by air guns. P-waves that impinge on an interface at non-normal incidence can produce S-waves, which in that case are known as converted waves. S-waves can likewise be converted to P-waves. S-waves, or shear waves, travel more slowly than P-waves and cannot travel through fluids because fluids do not support shear. Recording of S-waves requires receivers coupled to the solid Earth. Interpretation of S-waves can allow determination of rock properties such as fracture density and orientation, Poisson's ratio and rock type by crossplotting P-wave and S-wave velocities, and by other techniques.",Geophysics,https://glossary.slb.com/en/terms/s/s-wave
salt proximity survey,"[Geophysics] A type of refraction survey to help define a salt-sediment interface near a wellbore. The source is typically placed directly above the top of a salt dome and the receivers are placed at a number of locations within the borehole. This technique takes advantage of the fact that sound travels faster through the salt than the surrounding soft sediments, such as in the US Gulf Coast. This survey measures the fastest travel path, with part of its path through the salt. The resultant traveltimes are then inverted via a model to obtain a profile of the salt flanks relative to the borehole.",Geophysics,https://glossary.slb.com/en/terms/s/salt_proximity_survey
salt-proximity vertical seismic profile (VSP),[Geophysics] A type of reflection survey to help define a salt-sediment interface near a wellbore.,Geophysics,https://glossary.slb.com/en/terms/s/salt-proximity_vertical_seismic_profile
sample frequency,[Geophysics] The number of data points or measurements per unit of time or distance.,Geophysics,https://glossary.slb.com/en/terms/s/sample_frequency
sample interval,[Geophysics] The distance or time between data points or measurements.,Geophysics,https://glossary.slb.com/en/terms/s/sample_interval
sample rate,"[Geophysics] The number of measurements per unit of time, or the inverse of the sample interval.",Geophysics,https://glossary.slb.com/en/terms/s/sample_rate
seabed geophone,[Geophysics] A type of receiver that can be positioned on the seafloor to acquire seismic data.,Geophysics,https://glossary.slb.com/en/terms/s/seabed_geophone
secondary reflection,"[Geophysics] Multiply reflected seismic energy, or any event in seismic data that has incurred more than one reflection in its travel path. Depending on their time delay from the primary events with which they are associated, multiples are characterized as short-path or peg-leg, implying that they interfere with the primary reflection, or long-path, where they appear as separate events. Multiples from the water bottom (the interface of the base of water and the rock or sediment beneath it) and the air-water interface are common in marine seismic data, and are suppressed by seismic processing.",Geophysics,https://glossary.slb.com/en/terms/s/secondary_reflection
seismic,"[Geophysics] Pertaining to waves of elastic energy, such as that transmitted by P-waves and S-waves, in the frequency range of approximately 1 to 100 Hz. Seismic energy is studied by scientists to interpret the composition, fluid content, extent and geometry of rocks in the subsurface. ""Seismic,"" used as an adjective, is preferable to ""seismics,"" although ""seismics"" is used commonly as a noun.",Geophysics,https://glossary.slb.com/en/terms/s/seismic
seismic acquisition,"[Geophysics] The generation and recording of seismic data. Acquisition involves many different receiver configurations, including laying geophones or seismometers on the surface of the Earth or seafloor, towing hydrophones behind a marine seismic vessel, suspending hydrophones vertically in the sea or placing geophones in a wellbore (as in a vertical seismic profile) to record the seismic signal. A source, such as a vibrator unit, dynamite shot, or an air gun, generates acoustic or elastic vibrations that travel into the Earth, pass through strata with different seismic responses and filtering effects, and return to the surface to be recorded as seismic data. Optimal acquisition varies according to local conditions and involves employing the appropriate source (both type and intensity), optimal configuration of receivers, and orientation of receiver lines with respect to geological features. This ensures that the highest signal-to-noise ratio can be recorded, resolution is appropriate, and extraneous effects such as air waves, ground roll, multiples and diffractions can be minimized or distinguished, and removed through processing.",Geophysics,https://glossary.slb.com/en/terms/s/seismic_acquisition
seismic impedance,"[Geophysics] Another term for acoustic impedance, the product of density and seismic velocity, which varies among different rock layers, commonly symbolized by Z. The difference in acoustic impedance between rock layers affects the reflection coefficient.",Geophysics,https://glossary.slb.com/en/terms/s/seismic_impedance
seismic interpretation,[Geophysics] Analysis of seismic data to generate reasonable models and predictions about the properties and structures of the subsurface. Interpretation of seismic data is the primary concern of geophysicists.,Geophysics,https://glossary.slb.com/en/terms/s/seismic_interpretation
seismic line,"[Geophysics] A display of seismic data along a line, such as a 2D seismic profile or a profile extracted from a volume of 3D seismic data. A seismic section consists of numerous traces with location given along the x-axis and two-way traveltime or depth along the y-axis. The section is called a depth section if the section has been converted from time to depth and a time section if this has not been done.",Geophysics,https://glossary.slb.com/en/terms/s/seismic_line
seismic modeling,"[Geophysics] The comparison, simulation or representation of seismic data to define the limits of seismic resolution, assess the ambiguity of interpretation or make predictions. Generation of a synthetic seismogram from a well log and comparing the synthetic, or modeled trace, with seismic data is a common direct modeling procedure. Generating a set of pseudologs from seismic data is the process known as seismic inversion, a type of indirect modeling. Models can be developed to address problems of structure and stratigraphy prior to acquisition of seismic data and during the interpretation of the data. As Sheriff (1991) points out, agreement between data and a model does not prove that the model is correct, since there can be numerous models that agree with a given data set.",Geophysics,https://glossary.slb.com/en/terms/s/seismic_modeling
seismic processing,"[Geophysics] Alteration of seismic data to suppress noise, enhance signal and migrate seismic events to the appropriate location in space. Processing steps typically include analysis of velocities and frequencies, static corrections, deconvolution, normal moveout, dip moveout, stacking, and migration, which can be performed before or after stacking. Seismic processing facilitates better interpretation because subsurface structures and reflection geometries are more apparent.",Geophysics,https://glossary.slb.com/en/terms/s/seismic_processing
seismic record,[Geophysics] Traces recorded from a single shotpoint. Numerous seismic records are displayed together in a single seismic section.,Geophysics,https://glossary.slb.com/en/terms/s/seismic_record
seismic reflection tomography,"[Geophysics] A technique to measure and display the three-dimensional distribution of velocity or reflectivity of a volume of the Earth by using numerous sources and receivers at the Earth's surface. In reflection tomography, space is divided into cells, each having a certain velocity and reflectivity. The final model is the one whose velocities and reflectivities best describe the data.",Geophysics,https://glossary.slb.com/en/terms/s/seismic_reflection_tomography
seismic refraction method,"[Geophysics] A seismic aquisition method in which the incident and reflected angles are critical. These refraction surveys can be useful for evaluating increasing velocity gradients and locating features that have anomalously high velocities, such as a salt dome within surrounding rocks of lower velocities.",Geophysics,https://glossary.slb.com/en/terms/s/seismic_refraction_method
seismic section,"[Geophysics] A display of seismic data along a line, such a 2D seismic profile or a profile extracted from a volume of 3D seismic data. A seismic section consists of numerous traces with location given along the x-axis and two-way traveltime or depth along the y-axis. The section is called a depth section if the section has been converted from time to depth and a time section if this has not been done.",Geophysics,https://glossary.slb.com/en/terms/s/seismic_section
seismic stratigraphy,"[Geophysics] Another term for sequence stratigraphy, a field of study in which basin-filling sedimentary deposits, called sequences, are interpreted in a framework of eustasy, sedimentation and subsidence through time in order to correlate strata and predict the stratigraphy of relatively unknown areas. Sequences tend to show cyclicity of changes in relative sea level and widespread unconformities, processes of sedimentation and sources of sediments, climate and tectonic activity over time. Sequence stratigraphic study promotes thorough understanding of the evolution of basins, but also allows for interpretations of potential source rocks and reservoir rocks in both frontier areas (having seismic data but little well data) and in more mature hydrocarbon provinces. Prediction of reservoir continuity is currently a key question in mature hydrocarbon provinces where sequence stratigraphy is being applied. The field originated during the 1960s with the study of the stratigraphy of the continental USA, where numerous unconformities could be correlated widely, and led to the proposal that major unconformities might mark synchronous global-scale events. Through sequence stratigraphy, widely-separated sediments that occur between correlatable unconformities could be compared with each other. Studies of outcrops and seismic lines bore out these concepts, which initially were called ""Seismic Stratigraphy"" and first published widely in 1977. Further study of seismic lines led to the interpretation of the geometry or architecture of seismic events as representing particular styles of sedimentation and depositional environments, and the integration of such interpretations with well log and core data. Because of the simultaneous, competitive nature of the research, numerous oil companies and academic groups use the terminology of sequence stratigraphy differently, and new terms are added continually.",Geophysics,https://glossary.slb.com/en/terms/s/seismic_stratigraphy
seismic survey,"[Geophysics] A seismic dataset measured and recorded with reference to a particular area of the Earth's surface, to evaluate the subsurface.",Geophysics,https://glossary.slb.com/en/terms/s/seismic_survey
seismic trace,[Geophysics] The seismic data recorded for one channel. A seismic trace represents the response of the elastic wavefield to velocity and density contrasts across interfaces of layers of rock or sediments as energy travels from a source through the subsurface to a receiver or receiver array.,Geophysics,https://glossary.slb.com/en/terms/s/seismic_trace
seismic velocity,"[Geophysics] The rate at which a seismic wave travels through a medium, that is, distance divided by traveltime. Seismic velocity can be determined from vertical seismic profiles or from velocity analysis of seismic data. It can vary vertically, laterally and azimuthally in anisotropic media and tends to increase with depth in the Earth because compaction reduces porosity. Velocity also varies as a function of how it is derived from the data. For example, the stacking velocity derived from normal moveout measurements of common depth point gathers differs from the average velocity measured vertically from a check-shot or vertical seismic profile (VSP). Velocity would be the same only in a constant-velocity (homogeneous) medium.",Geophysics,https://glossary.slb.com/en/terms/s/seismic_velocity
seismic wave,"[Geophysics] A periodic vibrational disturbance in which energy is propagated through or on the surface of a medium without translation of the material. Waves can be differentiated by their frequency, amplitude, wavelength and speed of propagation. Seismic waves are waves of elastic energy, such as that transmitted by P-waves and S-waves, in the frequency range of approximately 1 to 100 Hz. Seismic energy is studied by scientists to interpret the composition, fluid content, extent and geometry of rocks in the subsurface. Wavelength is defined as: λ = v/f, where λ = wavelength v = speed of propagation f = frequency.",Geophysics,https://glossary.slb.com/en/terms/s/seismic_wave
seismic-while-drilling vertical seismic profile,"[Geophysics] A technique using a seismic source on the surface and receivers in the borehole to acquire a vertical seismic profile (VSP) during pipe connections. Waveforms are transmitted to the surface during drilling operations and can be processed in time to yield reliable time-depth information and sometimes reflection information. Because the survey and analysis can be performed while a well is being drilled, the data can be considered in decisions during drilling operations.",Geophysics,https://glossary.slb.com/en/terms/s/seismic-while-drilling_vertical_seismic_profile
seismogram,[Geophysics] Traces recorded from a single shotpoint. Numerous seismograms are displayed together in a single seismic section.,Geophysics,https://glossary.slb.com/en/terms/s/seismogram
seismograph,"[Geophysics] A device or system that records the ground oscillations that make up exploration seismic data or earthquakes, sometimes used incorrectly as a synonym for geophone. A seismograph can include amplifiers, receivers and a recording device (such as a computer disk or magnetic tape) to record seismograms. A crude seismograph was built in 1855 by Italian physicist Luigi Palmieri (1807 to 1896). The modern seismograph, which used a pendulum, was invented in 1880 by James Ewing, Thomas Gray and Sir John Milne.",Geophysics,https://glossary.slb.com/en/terms/s/seismograph
seismology,"[Geophysics] The study of seismic or elastic waves, such as from earthquakes, explosions or other causes. Interpretation of the structure and composition of the Earth from artificially created seismic waves is a chief concern of seismologists exploring for hydrocarbons and other resources. English physicist John Mitchell (1724 to 1793) is known as the founder of seismology in part because of his observation that one can determine an earthquake's epicenter, or point of origin in the subsurface, by measuring the arrival time of earthquake waves at different locations. The invention of the modern seismograph in 1880 promoted further studies of earthquakes.",Geophysics,https://glossary.slb.com/en/terms/s/seismology
seismometer,[Geophysics] A device that records seismic energy in the form of ground motion and transforms it to an electrical impulse.,Geophysics,https://glossary.slb.com/en/terms/s/seismometer
semblance,"[Geophysics] A quantitative measure of the coherence of seismic data from multiple channels that is equal to the energy of a stacked trace divided by the energy of all the traces that make up the stack. If data from all channels are perfectly coherent, or show continuity from trace to trace, the semblance has a value of unity.",Geophysics,https://glossary.slb.com/en/terms/s/semblance
sensitivity,"1. (n.) [Geophysics] The smallest change in a measurement that can be recorded by an instrument. | 2. (n.) [Enhanced Oil Recovery] In matrix stimulation, a characteristic of rock that indicates the degree of reaction between the rock minerals and a given treating fluid. A formation is described as sensitive if a given stimulating fluid damages the formation. The detrimental reactions include disaggregation and collapse of the matrix, release of fines or formation of precipitates. Sensitivity depends on the overall reactivity of the formation minerals with the fluid; reactivity depends on the structure of the rock and the distribution of minerals within the rock. Sandstone sensitivity also depends on permeability; low-permeability formations are normally more sensitive than high-permeability sandstones for a given mineralogy because certain types of damage, such as formation of precipitates, are more harmful in small pore throats (as in low-permeability formations).",Enhanced Oil Recovery; Geophysics,https://glossary.slb.com/en/terms/s/sensitivity
SH-wave,[Geophysics] A shear wave that is polarized so that its particle motion and direction of propagation are contained in a horizontal plane.,Geophysics,https://glossary.slb.com/en/terms/s/sh-wave
shadow zone,"[Geophysics] Generally, an area of the Earth from which waves do not emerge or cannot be recorded. In seismology, the term is used to more specifically describe regions of the subsurface where P-waves and S-waves are difficult to detect, such as regions of the core at certain distances from the epicenter of an earthquake, or the point on the Earth's surface directly above an earthquake. Such zones were first observed in 1914 by Beno Gutenberg (1889 to 1960), an American geologist born in Germany. Because of the molten nature of the outer core, S-waves are especially difficult to detect at 103 to 142 degrees from the epicenter of an earthquake and not observable from 142 to 180 degrees from the epicenter. Areas below salt features are also called shadow zones because the high velocity of salt bends and traps energy, so seismic data quality beneath salt is generally poor unless special seismic processing is performed.",Geophysics,https://glossary.slb.com/en/terms/s/shadow_zone
shaped charge,"1. (n.) [Geophysics] Explosives designed to affect a certain direction preferentially. Shaped charges are most commonly used to perforate wells, but can be an energy source for seismic acquisition. | 2. (n.) [Perforating] An explosive device that utilizes a cavity-effect explosive reaction to generate a high-pressure, high-velocity jet that creates a perforation tunnel. The shape of the explosive material and powdered metal lining determine the shape of the jet and performance characteristics of the charge. The extremely high pressure and velocity of the jet cause materials, such as steel, cement and rock formations, to flow plastically around the jet path, thereby creating the perforation tunnel.",Geophysics; Perforating,https://glossary.slb.com/en/terms/s/shaped_charge
shear,"[Geophysics] A type of vertical seismic profile in which the source is a shear-wave source rather than a compressional-wave source. Shear waves travel through the Earth at about half the speed of compressional waves and respond differently to fluid-filled rock, and so can provide different additional information about lithology and fluid content of hydrocarbon-bearing reservoirs.",Geophysics,https://glossary.slb.com/en/terms/s/shear
shear modulus,"[Geophysics] An elastic constant for the ratio of shear stress to shear strain. The shear modulus is one of the Lamé constants. It can be expressed mathematically as follows: μ = τ / γ = (ΔF/A) / (ΔL/L), where μ = Shear modulus τ = Shear stress = ΔF/A ΔF = Increment of shear force A = Area acted on by the shear force γ = Shear strain = ΔL/L ΔL = Increment of transverse displacement parallel to A L = Original length.",Geophysics,https://glossary.slb.com/en/terms/s/shear_modulus
shear wave,"[Geophysics] Also known as S-wave, an elastic body wave in which particles oscillate perpendicular to the direction in which the wave propagates. S-waves are generated by most land seismic sources, but not by air guns. P-waves that impinge on an interface at non-normal incidence can produce S-waves, which in that case are known as converted waves. S-waves can likewise be converted to P-waves. S-waves, or shear waves, travel more slowly than P-waves and cannot travel through fluids because fluids do not support shear. Recording of S-waves requires receivers coupled to the solid Earth. Interpretation of S-waves can allow determination of rock properties such as fracture density and orientation, Poisson's ratio and rock type by crossplotting P-wave and S-wave velocities, and by other techniques.",Geophysics,https://glossary.slb.com/en/terms/s/shear_wave
shoot a well,"1. (vb.) [Geophysics] To acquire a type of borehole seismic data designed to measure the seismic traveltime from the surface to a known depth. P-wave velocity of the formations encountered in a wellbore can be measured directly by lowering a geophone to each formation of interest, sending out a source of energy from the surface of the Earth, and recording the resultant signal. The data can then be correlated to surface seismic data by correcting the sonic log and generating a synthetic seismogram to confirm or modify seismic interpretations. It differs from a vertical seismic profile in the number and density of receiver depths recorded; geophone positions may be widely and irregularly located in the wellbore, whereas a vertical seismic profile usually has numerous geophones positioned at closely and regularly spaced intervals in the wellbore. | 2. (vb.) [Perforating] To perforate a wellbore in preparation for production.",Geophysics; Perforating,https://glossary.slb.com/en/terms/s/shoot_a_well
short-path multiple,"[Geophysics] Multiply-reflected seismic energy with a shorter travel path than long-path multiples. Short-path multiples tend to come from shallow subsurface phenomena or highly cyclical sedimentation and arrive soon after, and sometimes very near, the primary reflections. Short-path multiples are less obvious than most long-path multiples and are less easily removed by seismic processing.",Geophysics,https://glossary.slb.com/en/terms/s/short-path_multiple
shot depth,"[Geophysics] The location of an explosive seismic source below the surface. Before acquisition of surface seismic data onshore using explosive sources such as dynamite, holes are drilled at shotpoints and dynamite is placed in the holes. The shotholes can be more than 50 m [164 ft] deep, although depths of 6 to 30 m [20 to 98 ft] are most common and depth is selected according to local conditions. With other ""surface"" sources, such as vibrators and shots from air shooting, the shots occur at the Earth's surface.",Geophysics,https://glossary.slb.com/en/terms/s/shot_depth
shot point,[Geophysics] One of a number of locations or stations at the surface of the Earth at which a seismic source is activated.,Geophysics,https://glossary.slb.com/en/terms/s/shot_point
shotpoint,[Geophysics] One of a number of locations or stations at the surface of the Earth at which a seismic source is activated.,Geophysics,https://glossary.slb.com/en/terms/s/shotpoint
side-scan sonar,[Geophysics] A system for acoustic surveying most commonly deployed in marine environments and towed by a ship. The side-scan sonar generates a pulse on the order of 30 to 120 kHz that is reflected from the seafloor. Side-scan sonar records yield an image of the seafloor and shallow sediments.,Geophysics,https://glossary.slb.com/en/terms/s/side-scan_sonar
sideswipe,"[Geophysics] A type of event in 2D seismic data in which a feature out of the plane of a seismic section is apparent, such as an anticline, fault or other geologic structure. A properly migrated 3D survey will not contain sideswipes.",Geophysics,https://glossary.slb.com/en/terms/s/sideswipe
signal,"[Geophysics] The portion of the seismic wave that contains desirable information. Noise is the undesirable information that typically accompanies the signal and can, to some extent, be filtered out of the data.",Geophysics,https://glossary.slb.com/en/terms/s/signal
