term,definition,disciplines,url
abnormal events,"[Geophysics] A term to indicate features in seismic data other than reflections, including events such as diffractions, multiples, refractions, and surface waves. Although the term suggests that such events are not common, they often occur in seismic data.",Geophysics,https://glossary.slb.com/en/terms/a/abnormal_events
absorbing boundary conditions,[Geophysics] An algorithm used in numerical simulation along the boundary of a computational domain to absorb all energy incident upon that boundary and to suppress reflection artifacts.,Geophysics,https://glossary.slb.com/en/terms/a/absorbing_boundary_conditions
absorptance,[Geophysics] The ratio of absorbed incident energy to the total energy to which a body is exposed.,Geophysics,https://glossary.slb.com/en/terms/a/absorptance
absorption,"1. (n.) [Geophysics] The conversion of one form of energy into another as the energy passes through a medium. For example, seismic waves are partially converted to heat as they pass through rock. | 2. (n.) [Production Facilities] The property of some liquids or solids to soak up water or other fluids. The natural gas dehydration process uses glycols (liquids) that absorb the water vapor to finally obtain dehydrated gas. In the same way, light oil, also called absorption oil, is used to remove the heavier liquid hydrocarbons from a wet gas stream to obtain dry gas.",Geophysics; Production Facilities,https://glossary.slb.com/en/terms/a/absorption
absorption band,[Geophysics] The range of wavelengths of energy that can be absorbed by a given substance.,Geophysics,https://glossary.slb.com/en/terms/a/absorption_band
accelerometer,"[Geophysics] A device used during surveying to measure the acceleration of a ship or aircraft, or to detect ground acceleration in boreholes or on the Earth's surface produced by acoustic vibrations.",Geophysics,https://glossary.slb.com/en/terms/a/accelerometer
acoustic,"1. (adj.) [Geophysics] Pertaining to sound. Generally, acoustic describes sound or vibrational events, regardless of frequency. The term sonic is limited to frequencies and tools operated in the frequency range of 1 to 25 kilohertz. | 2. (adj.) [Geophysics] In geophysics, acoustic refers specifically to P-waves in the absence of S-waves (i.e., in fluids, which do not support S-waves, or in cases in which S-waves in solids are ignored).",Geophysics,https://glossary.slb.com/en/terms/a/acoustic
acoustic basement,"[Geophysics] The portion of the Earth below which strata cannot be imaged with seismic data, or the deepest relatively continuous reflector. Acoustic basement, in some regions, coincides with economic basement and geologic basement, or that portion of the Earth that does not comprise sedimentary rocks.",Geophysics,https://glossary.slb.com/en/terms/a/acoustic_basement
acoustic coupler,[Geophysics] An obsolete piece of equipment that converts acoustic signals from analog to electrical form and back. A common use of an acoustic coupler was to provide an interface between a telephone and an early type of computer modem.,Geophysics,https://glossary.slb.com/en/terms/a/acoustic_coupler
acoustic emission,[Geophysics] A type of elastic wave produced by deformation or brittle failure of material and characterized by relatively high frequency.,Geophysics,https://glossary.slb.com/en/terms/a/acoustic_emission
acoustic impedance,"[Geophysics] The product of density and seismic velocity, which varies among different rock layers, commonly symbolized by Z. The difference in acoustic impedance between rock layers affects the reflection coefficient.",Geophysics,https://glossary.slb.com/en/terms/a/acoustic_impedance
acoustic impedance section,"[Geophysics] A seismic reflectivity section, or a 2D or 3D seismic section, that has been inverted for acoustic impedance. Sonic and density logs can be used to calibrate acoustic impedance sections.",Geophysics,https://glossary.slb.com/en/terms/a/acoustic_impedance_section
acoustic log,"1. (n.) [Geophysics] A display of traveltime of acoustic waves versus depth in a well. The term is commonly used as a synonym for a sonic log. Some acoustic logs display velocity. | 2. (n.) [Formation Evaluation] A record of some acoustic property of the formation or borehole. The term is sometimes used to refer specifically to the sonic log, in the sense of the formation compressional slowness. However, it may also refer to any other sonic measurement, for example shear, flexural and Stoneley slownesses or amplitudes, or to ultrasonic measurements such as the borehole televiewer and other pulse-echo devices, and even to noise logs.",Formation Evaluation; Geophysics,https://glossary.slb.com/en/terms/a/acoustic_log
acoustic positioning,"[Geophysics] A method of calculating the position of marine seismic equipment. Range measurements are made whereby distance is equal to acoustic signal traveltime from transmitter to hydrophone multiplied by the speed of sound in water. When sufficient acoustic ranges with a proper geometric distribution are collected, location coordinates x, y and z of the marine seismic equipment can be computed by the method of trilateration (measuring the lengths of the sides of overlapping triangles). Acoustic positioning is commonly used in towed streamer and ocean-bottom cable seismic acquisition modes.",Geophysics,https://glossary.slb.com/en/terms/a/acoustic_positioning
acoustic transparency,"[Geophysics] The quality of a medium whose acoustic impedance is constant throughout, such that it contains no seismic reflections. An example of an acoustically transparent medium is water.",Geophysics,https://glossary.slb.com/en/terms/a/acoustic_transparency
acoustic traveltime,[Geophysics] The duration of the passage of a signal from the source through the Earth and back to the receiver. A time seismic section typically shows the two-way traveltime of the wave.,Geophysics,https://glossary.slb.com/en/terms/a/acoustic_traveltime
acoustic velocity,"[Geophysics] The rate at which a sound wave travels through a medium. Unlike the physicist's definition of velocity as a vector, its usage in geophysics is as a property of a medium: distance divided by traveltime. Velocity can be determined from laboratory measurements, acoustic logs, vertical seismic profiles or from velocity analysis of seismic data. It can vary vertically, laterally and azimuthally in anisotropic media such as rocks, and tends to increase with depth in the Earth because compaction reduces porosity. Velocity also varies as a function of how it is derived from the data. For example, the stacking velocity derived from normal moveout measurements of common depth point gathers differs from the average velocity measured vertically from a check-shot or vertical seismic profile (VSP). Velocity would be the same only in a constant-velocity (homogeneous) medium.",Geophysics,https://glossary.slb.com/en/terms/a/acoustic_velocity
acoustic velocity log,[Geophysics] A display of traveltime of acoustic waves versus depth in a well. The term is commonly used as a synonym for a sonic log. Some acoustic logs display velocity.,Geophysics,https://glossary.slb.com/en/terms/a/acoustic_velocity_log
acoustic wave,"[Geophysics] An elastic body wave or sound wave in which particles oscillate in the direction the wave propagates. P-waves are the waves studied in conventional seismic data. P-waves incident on an interface at other than normal incidence can produce reflected and transmitted S-waves, in that case known as converted waves.",Geophysics,https://glossary.slb.com/en/terms/a/acoustic_wave
acquisition,"[Geophysics] The generation and recording of seismic data. Acquisition involves many different receiver configurations, including laying geophones or seismometers on the surface of the Earth or seafloor, towing hydrophones behind a marine seismic vessel, suspending hydrophones vertically in the sea or placing geophones in a wellbore (as in a vertical seismic profile) to record the seismic signal. A source, such as a vibrator unit, dynamite shot, or an air gun, generates acoustic or elastic vibrations that travel into the Earth, pass through strata with different seismic responses and filtering effects, and return to the surface to be recorded as seismic data. Optimal acquisition varies according to local conditions and involves employing the appropriate source (both type and intensity), optimal configuration of receivers, and orientation of receiver lines with respect to geological features. This ensures that the highest signal-to-noise ratio can be recorded, resolution is appropriate, and extraneous effects such as air waves, ground roll, multiples and diffractions can be minimized or distinguished, and removed through processing.",Geophysics,https://glossary.slb.com/en/terms/a/acquisition
aeolotropy,"[Geology, Geophysics, Shale Gas] Predictable variation of a property of a material with the direction in which it is measured, which can occur at all scales. For a crystal of a mineral, variation in physical properties observed in different directions is aeolotropy (also known as anisotropy). In rocks, variation in seismic velocity measured parallel or perpendicular to bedding surfaces is a form of aeolotropy. Often found where platy minerals such as micas and clays align parallel to depositional bedding as sediments are compacted, aeolotropy is common in shales.","Geology, Geophysics, Shale Gas",https://glossary.slb.com/en/terms/a/aeolotropy
aerated layer,"[Geology, Geophysics] The surface or near-surface, unconsolidated sedimentary layer that has been subject to weathering and whose pores are air-filled instead of liquid-filled. An aerated layer typically has a low seismic velocity.","Geology, Geophysics",https://glossary.slb.com/en/terms/a/aerated_layer
aeromagnetic survey,"[Geophysics] Measurements of the Earth's magnetic field gathered from aircraft. Magnetometers towed by an airplane or helicopter can measure the intensity of the Earth's magnetic field. The differences between actual measurements and theoretical values indicate anomalies in the magnetic field, which in turn represent changes in rock type or in thickness of rock units.",Geophysics,https://glossary.slb.com/en/terms/a/aeromagnetic_survey
AGC,"[Geophysics] Abbreviation for automatic gain control. A system to automatically control the gain, or the increase in the amplitude of an electrical signal from the original input to the amplified output. AGC is commonly used in seismic processing to improve visibility of late-arriving events in which attenuation or wavefront divergence has caused amplitude decay.",Geophysics,https://glossary.slb.com/en/terms/a/agc
AGC time constant,"[Geophysics] The exponential rate constant (τ) that determines how quickly the output amplitude of an electrical signal that is under automatic gain control (AGC) responds to a sudden increase or decrease in input signal amplitude. Mathematically, Af(t) = Ai(t) + ΔAi (1 − e−t/τ) where Af is the output signal amplitude, Ai is the input signal amplitude (Ai), ΔAi is the change in input signal amplitude and t is time. When t equals τ, the function (1 − e−t/τ) equals (1 − 1/e) equals 0.63. Therefore, the AGC time constant (τ) is the amount of time that elapses for the output signal of AGC to reflect 63% of the change in the input signal amplitude.",Geophysics,https://glossary.slb.com/en/terms/a/agc_time_constant
air gun,[Geophysics] A source of seismic energy used in acquisition of marine seismic data. This gun releases highly compressed air into water. Air guns are also used in water-filled pits on land as an energy source during acquisition of vertical seismic profiles.,Geophysics,https://glossary.slb.com/en/terms/a/air_gun
air shooting,[Geophysics] A method of seismic acquisition using charges detonated in the air or on poles above the ground as the source. Air shooting is also called the Poulter method after American geophysicist Thomas Poulter.,Geophysics,https://glossary.slb.com/en/terms/a/air_shooting
air wave,[Geophysics] A sound wave that travels through the air at approximately 330 m/s and can be generated and recorded during seismic surveying. Air waves are a type of coherent noise.,Geophysics,https://glossary.slb.com/en/terms/a/air_wave
alias filter,"[Geophysics] A filter, or a set of limits used to eliminate unwanted portions of the spectra of the seismic data, to remove frequencies that might cause aliasing during the process of sampling an analog signal during acquisition or when the sample rate of digital data is being decreased during seismic processing.",Geophysics,https://glossary.slb.com/en/terms/a/alias_filter
aliasing,"[Geophysics] The distortion of frequency introduced by inadequately sampling a signal, which results in ambiguity between signal and noise. Aliasing can be avoided by sampling at least twice the highest frequency of the waveform or by filtering frequencies above the Nyquist frequency, the highest frequency that can be defined accurately by that sampling interval.",Geophysics,https://glossary.slb.com/en/terms/a/aliasing
amplitude,"1. (n.) [Geophysics] The difference between the maximum displacement of a wave and the point of no displacement, or the null point. The common symbol for amplitude is a. | 2. (n.) [Geophysics] The amount of displacement of a seismic wavelet measured from peak to trough.",Geophysics,https://glossary.slb.com/en/terms/a/amplitude
amplitude anomaly,"[Geophysics] An abrupt increase in seismic amplitude that can indicate the presence of hydrocarbons, although such anomalies can also result from processing problems, geometric or velocity focusing or changes in lithology. Amplitude anomalies that indicate the presence of hydrocarbons can result from sudden changes in acoustic impedance, such as when a gas sand underlies a shale, and in that case, the term is used synonymously with hydrocarbon indicator.",Geophysics,https://glossary.slb.com/en/terms/a/amplitude_anomaly
amplitude distortion,"1. (n.) [Geophysics] The inability of a system to exactly match input and output amplitude, a general example being an electronic amplifier and the classic example being a home stereophonic amplifier. | 2. (n.) [Geophysics] A change in the amplitude of a waveform that is generally undesirable, such as in seismic waves.",Geophysics,https://glossary.slb.com/en/terms/a/amplitude_distortion
amplitude variation with offset,"[Geophysics] Variation in seismic reflection amplitude with change in distance between shotpoint and receiver that indicates differences in lithology and fluid content in rocks above and below the reflector. AVO analysis is a technique by which geophysicists attempt to determine thickness, porosity, density, velocity, lithology and fluid content of rocks. Successful AVO analysis requires special processing of seismic data and seismic modeling to determine rock properties with a known fluid content. With that knowledge, it is possible to model other types of fluid content. A gas-filled sandstone might show increasing amplitude with offset, whereas a coal might show decreasing amplitude with offset. A limitation of AVO analysis using only P-energy is its failure to yield a unique solution, so AVO results are prone to misinterpretation. One common misinterpretation is the failure to distinguish a gas-filled reservoir from a reservoir having only partial gas saturation (""fizz water""). However, AVO analysis using source-generated or mode-converted shear wave energy allows differentiation of degrees of gas saturation. AVO analysis is more successful in young, poorly consolidated rocks, such as those in the Gulf of Mexico, than in older, well-cemented sediments.",Geophysics,https://glossary.slb.com/en/terms/a/amplitude_variation_with_offset
amplitude variation with offset and azimuth,[Geophysics] The azimuthal variation of the AVO response.,Geophysics,https://glossary.slb.com/en/terms/a/amplitude_variation_with_offset_and_azimuth
angle of approach,"[Geophysics] The acute angle at which a wavefront impinges upon an interface, such as a seismic wave impinging upon strata. Normal incidence is the case in which the angle of incidence is zero, the wavefront is parallel to the surface and its raypath is perpendicular, or normal, to the interface. Snell's law describes the relationship between the angle of incidence and the angle of refraction of a wave.",Geophysics,https://glossary.slb.com/en/terms/a/angle_of_approach
angle of incidence,"[Geophysics] The acute angle at which a raypath impinges upon a line normal to an interface, such as a seismic wave impinging upon strata. Normal incidence is the case in which the angle of incidence is zero, the wavefront is parallel to the surface and its raypath is perpendicular, or normal, to the interface. Snell's law describes the relationship between the angle of incidence and the angle of refraction of a wave.",Geophysics,https://glossary.slb.com/en/terms/a/angle_of_incidence
angular dispersion,[Geophysics] The variation of seismic velocity in different directions.,Geophysics,https://glossary.slb.com/en/terms/a/angular_dispersion
anisotropic,"[Geophysics, Geology, Shale Gas] Having directionally dependent properties. For a crystal of a mineral, variation in physical properties observed in different directions is anisotropy. In rocks, variation in seismic velocity measured parallel or perpendicular to bedding surfaces is a form of anisotropy. Often found where platy minerals such as micas and clays align parallel to depositional bedding as sediments are compacted, anisotropy is common in shales. Antonyms: isotropic","Geophysics, Geology, Shale Gas",https://glossary.slb.com/en/terms/a/anisotropic
anisotropy,"[Geophysics, Shale Gas, Geology] Predictable variation of a property of a material with the direction in which it is measured, which can occur at all scales. For a crystal of a mineral, variation in physical properties observed in different directions is anisotropy. In rocks, variation in seismic velocity measured parallel or perpendicular to bedding surfaces is a form of anisotropy. Often found where platy minerals such as micas and clays align parallel to depositional bedding as sediments are compacted, anisotropy is common in shales.","Geophysics, Shale Gas, Geology",https://glossary.slb.com/en/terms/a/anisotropy
antialias filter,"[Geophysics] A filter, or a set of limits used to eliminate unwanted portions of the spectra of the seismic data, to remove frequencies that might cause aliasing during the process of sampling an analog signal during acquisition or when the sample rate of digital data is being decreased during seismic processing.",Geophysics,https://glossary.slb.com/en/terms/a/antialias_filter
aperture,"1. (n.) [Geophysics] A portion of a dataset, such as seismic data, to which functions or filters are applied. Aperture time, for example, can be specified, such as a window from 1.2 to 2.8 seconds. | 2. (n.) [Geophysics] A mechanism to limit the affects of measurements on a device or system. In seismic data acquisition, the length of the spread has the effect of an aperture.",Geophysics,https://glossary.slb.com/en/terms/a/aperture
apparent anisotropy,"[Geophysics] In seismic data, the ratio of the velocity determined from normal moveout (i.e., primarily a horizontal measurement) to velocity measured vertically in a vertical seismic profile or similar survey. Apparent anisotropy is of particular importance when migrating long-offset seismic data and analyzing AVO data accurately. The normal moveout velocity involves the horizontal component of the velocity field, which affects sources and receivers that are offset, but the horizontal velocity field is not involved in velocity calculations from vertically measured time-depth pairs.",Geophysics,https://glossary.slb.com/en/terms/a/apparent_anisotropy
apparent velocity,"[Geophysics] In geophysics, the velocity of a wavefront in a certain direction, typically measured along a line of receivers and symbolized by va. Apparent velocity and velocity are related by the cosine of the angle at which the wavefront approaches the receivers: va = v cos θ, where va = apparent velocity v = velocity of wavefront θ = angle at which a wavefront approaches the geophone array.",Geophysics,https://glossary.slb.com/en/terms/a/apparent_velocity
apparent wavelength,"[Geophysics] The wavelength measured by receivers when a wave approaches at an angle. The relationship between true and apparent wavelength can be shown mathematically as follows: λ = λa sin θ, where λ = wavelength λa = apparent wavelength θ = angle at which a wavefront approaches the geophone array.",Geophysics,https://glossary.slb.com/en/terms/a/apparent_wavelength
applied-potential method,[Geophysics] A technique to map a potential field generated by stationary electrodes by moving an electrode around the survey area.,Geophysics,https://glossary.slb.com/en/terms/a/applied-potential_method
array,"1. (n.) [Geophysics] Generally, a geometrical configuration of transducers (sources or receivers) used to generate or record a physical field, such as an acoustic or electromagnetic wavefield or the Earth's gravity field. | 2. (n.) [Geophysics] A geometrical arrangement of seismic sources (a source array, with each individual source being activated in some fixed sequence in time) or receivers (a hydrophone or geophone array) that is recorded by one channel. | 3. (n.) [Geophysics] An arrangement or configuration of electrodes or antennas used for resistivity, induced polarization (IP), or other types of electromagnetic surveying. Resistivity arrays typically consist of two current electrodes and two potential electrodes and are distinguished by the relative separations between the electrodes. Examples are the dipole-dipole, Schlumberger and Wenner arrays. | 4. (n.) [Geophysics] In computing, code written to access data in more than one dimension according to a name and subscripts that correspond to each dimension.",Geophysics,https://glossary.slb.com/en/terms/a/array
arrival,"[Geophysics] An event or appearance of seismic data as a reflection, refraction, diffraction, or other similar feature, or the time at which seismic data appear. An event in a seismic section can represent a geologic interface.",Geophysics,https://glossary.slb.com/en/terms/a/arrival
arrival time,[Geophysics] The elapsed time between the release of seismic energy from a source and its arrival at the receiver.,Geophysics,https://glossary.slb.com/en/terms/a/arrival_time
attenuate,"[Geophysics] The removal of undesirable features, such as multiple events, from seismic data.",Geophysics,https://glossary.slb.com/en/terms/a/attenuate
attenuation,"1. (n.) [Geophysics] The loss of energy or amplitude of waves as they pass through media. Seismic waves lose energy through absorption, reflection, and refraction at interfaces; mode conversion and spherical divergence; or spreading of the wave. | 2. (n.) [Formation Evaluation] The reduction in amplitude of an electromagnetic wave passing through the formation, usually measured in decibels per meter, dB/m. The term is used in particular with reference to the propagation resistivity log and the electromagnetic propagation log.",Formation Evaluation; Geophysics,https://glossary.slb.com/en/terms/a/attenuation
attribute,"[Geophysics] A measurable property of seismic data, such as amplitude, dip, frequency, phase, and polarity. Attributes can be measured at one instant in time or over a time window, and may be measured on a single trace, on a set of traces, or on a surface interpreted from seismic data. Attribute analysis includes assessment of various reservoir parameters, including a hydrocarbon indicator, by techniques such as amplitude variation with offset (AVO) analysis.",Geophysics,https://glossary.slb.com/en/terms/a/attribute
autocorrelation,"[Geophysics] The comparison of a waveform to itself. Autocorrelation is useful in the identification of multiples or other regularly repeating signals, and in designing deconvolution filters to suppress them.",Geophysics,https://glossary.slb.com/en/terms/a/autocorrelation
automatic gain control,"[Geophysics] A system to automatically control the gain, or the increase in the amplitude of an electrical signal from the original input to the amplified output. AGC is commonly used in seismic processing to improve visibility of late-arriving events in which attenuation or wavefront divergence has caused amplitude decay.",Geophysics,https://glossary.slb.com/en/terms/a/automatic_gain_control
autotrack,"[Geophysics] To use computer software to pick a particular reflection or attribute in seismic data automatically. Autotracking can speed interpretation of three-dimensional seismic data but must be checked for errors, especially in areas of faulting and stratigraphic changes.",Geophysics,https://glossary.slb.com/en/terms/a/autotrack
autotracking,"[Geophysics] Use of computer software to pick a particular reflection or attribute in seismic data automatically. Autotracking can speed interpretation of three-dimensional seismic data but must be checked for errors, especially in areas of faulting and stratigraphic changes.",Geophysics,https://glossary.slb.com/en/terms/a/autotracking
AVA,[Geophysics] Abbreviation for amplitude variation with angle of incidence.,Geophysics,https://glossary.slb.com/en/terms/a/ava
AVAZ,[Geophysics] Abbreviation for amplitude variation with azimuth.,Geophysics,https://glossary.slb.com/en/terms/a/avaz
average velocity,"[Geophysics] In geophysics, the depth divided by the traveltime of a wave to that depth. Average velocity is commonly calculated by assuming a vertical path, parallel layers, and straight raypaths, conditions that are quite idealized compared to those actually found in the Earth.",Geophysics,https://glossary.slb.com/en/terms/a/average_velocity
