term,definition,disciplines,url
deep seismic sounding,"[Geophysics] A seismic profile recorded specifically to study the lower crust, the Mohorovicic discontinuity and the mantle of the Earth, typically using refraction methods. Most standard seismic reflection profiles record only a small fraction (typically, on the order of 10 km [6 miles]) of the Earth's crust, which is 5 to 75 km [3 to 45 miles] thick.",Geophysics,https://glossary.slb.com/en/terms/d/deep_seismic_sounding
deep tow,"[Geophysics] A method of marine seismic acquisition in which a boat tows a receiver well below the surface of the water to get closer to features of interest or to reduce noise due to conditions of the sea. Deep tow devices are used for some side-scan sonar, gravity and magnetic surveys.",Geophysics,https://glossary.slb.com/en/terms/d/deep_tow
delta,"1. (n.) [Geology] An area of deposition or the deposit formed by a flowing sediment-laden current as it enters an open or standing body of water, such as a river spilling into a gulf. As a river enters a body of water, its velocity drops and its ability to carry sediment diminishes, leading to deposition. The term has origins in Greek because the shape of deltas in map view can be similar to the Greek letter delta. The shapes of deltas are subsequently modified by rivers, tides and waves. There is a characteristic coarsening upward of sediments in a delta. The three main classes of deltas are river-dominated (Mississippi River), wave-dominated (Nile River), and tide-dominated (Ganges River). Ancient deltas contain some of the largest and most productive petroleum systems. | 2. (n.) [Geophysics] An anisotropy parameter that describes near-vertical P-wave velocity anisotropy and the difference between the vertical and small-offset moveout velocity of P-waves. δ = ½{[(C13 + C44)2 − (C33 − C44)2] / [C33 (C33 − C44)]} Anisotropy parameter for near-vertical P-waves. Delta (δ) describes near-vertical P-wave velocity anisotropy and the difference between the vertical and small-offset moveout velocity of P-waves. C33 is the vertical P-wave modulus (parallel to the symmetry axis), C44 is the modulus for a vertically traveling and horizontally polarized S-wave (parallel to the symmetry axis) and C13 is the modulus of dilation in the vertical direction induced by compression in the horizontal direction. Reference: Thomsen L: “Weak Elastic Anisotropy,” Geophysics 51, no. 10 (October 1986): 1954–1966.",Geology; Geophysics,https://glossary.slb.com/en/terms/d/delta
delta t,"[Geophysics, Formation Evaluation] Also called interval transit time, the amount of time for a wave to travel a certain distance, proportional to the reciprocal of velocity, typically measured in microseconds per foot by an acoustic log and symbolized by t or DT. P-wave interval transit times for common sedimentary rock types range from 43 (dolostone) to 160 (unconsolidated shales) microseconds per foot, and can be distinguished from measurements of steel casing, which has a consistent transit time of 57 microseconds per foot.","Geophysics, Formation Evaluation",https://glossary.slb.com/en/terms/d/delta_t
density contrast,"[Geophysics] The variation in the mass per unit volume of rocks, which affects the local gravitational field of the Earth. A density contrast also contributes to an acoustic impedance contrast, which affects the reflection coefficient.",Geophysics,https://glossary.slb.com/en/terms/d/density_contrast
density profile,[Geophysics] A series of gravity measurements made along a line or over an area of a locally high topographic feature to remove or compensate for the effect of topography on deeper density readings.,Geophysics,https://glossary.slb.com/en/terms/d/density_profile
depth controller,[Geophysics] A device used in acquisition of marine seismic data that keeps streamers at a certain depth in the water.,Geophysics,https://glossary.slb.com/en/terms/d/depth_controller
depth conversion,"[Geophysics] The process of transforming seismic data from a scale of time (the domain in which they are acquired) to a scale of depth to provide a picture of the structure of the subsurface independent of velocity. Depth conversion, ideally, is an iterative process that begins with proper seismic processing, seismic velocity analysis and study of well data to refine the conversion. Acoustic logs, check-shot surveys and vertical seismic profiles can aid depth conversion efforts and improve correlation of well logs and drilling data with surface seismic data.",Geophysics,https://glossary.slb.com/en/terms/d/depth_conversion
depth map,[Geophysics] A two-dimensional representation of subsurface structure with contours in depth that have been converted from seismic traveltimes.,Geophysics,https://glossary.slb.com/en/terms/d/depth_map
depth migration,"[Geophysics] A step in seismic processing in which reflections in seismic data are moved to their correct locations in space, including position relative to shotpoints, in areas where there are significant and rapid lateral or vertical changes in velocity that distort the time image. This requires an accurate knowledge of vertical and horizontal seismic velocity variations.",Geophysics,https://glossary.slb.com/en/terms/d/depth_migration
depth point,[Geophysics] A point on the surface for which the depth to a horizon has been calculated in a refraction seismic survey. The term is commonly misused as a synonym for common depth point.,Geophysics,https://glossary.slb.com/en/terms/d/depth_point
depth section,[Geophysics] A display of seismic data with a scale of units of depth rather than time along the vertical axis. Careful migration and depth conversion are essential for creating depth sections.,Geophysics,https://glossary.slb.com/en/terms/d/depth_section
detectable limit,"[Geophysics] The minimum thickness necessary for a layer of rock to be visible or distinct in reflection seismic data. Generally, the detectable limit is at least 1/30 of the wavelength. Acquisition of higher frequency seismic data generally results in better detection or vertical resolution of thinner layers.",Geophysics,https://glossary.slb.com/en/terms/d/detectable_limit
detector,"[Geophysics] A sensor or receiver, such as a geophone or hydrophone, gravimeter or magnetometer.",Geophysics,https://glossary.slb.com/en/terms/d/detector
deterministic deconvolution,"[Geophysics] A type of inverse filtering, or deconvolution, in which the effects of the filter are known by observation or assumed, as opposed to statistical deconvolution.",Geophysics,https://glossary.slb.com/en/terms/d/deterministic_deconvolution
detonate,"[Perforating, Geophysics] To set off an explosive material. Explosive sources are used in seismic acquisition and explosive charges are used to perforate wells in preparation for production or injection.","Perforating, Geophysics",https://glossary.slb.com/en/terms/d/detonate
detonator,"1. (n.) [Geophysics] A small, electrically activated explosive charge that explodes a larger charge. Detonators, also called caps, seismic caps or blasting caps, are used for seismic acquisition with an explosive source to achieve consistent timing of detonation. | 2. (n.) [Perforating] A device containing primary high-explosive material that is used to initiate an explosive sequence. The two common types of detonators are electrical detonators (also known as blasting caps) and percussion detonators. Electrical detonators have a fuse material that burns when high voltage is applied to initiate the primary high explosive. Percussion detonators contain abrasive grit and primary high explosive in a sealed container that is activated by a firing pin. The impact force of the firing pin is sufficient to initiate the ballistic sequence that is then transmitted to the detonating cord. Several safety systems are used in conjunction with detonators to avoid accidental firing during rig-up or rig-down. Safety systems also are used to disarm the gun or ballistic assembly if downhole conditions are unsafe for firing.",Geophysics; Perforating,https://glossary.slb.com/en/terms/d/detonator
dielectric,[Geophysics] A material used in a capacitor to store a charge from an applied electrical field. A pure dielectric does not conduct electricity.,Geophysics,https://glossary.slb.com/en/terms/d/dielectric
difference map,"[Geophysics] A map that represents the change from one map to another, such as a reservoir map of an area made from two different seismic surveys separated in production history (one possible product of 4D seismic data), or an isochron map that displays the variation in time between two seismic events or reflections.",Geophysics,https://glossary.slb.com/en/terms/d/difference_map
differential weathering correction,"[Geophysics] A type of static correction that compensates for delays in seismic reflection or refraction times from one point to another, such as among geophone groups in a survey. These delays can be induced by low-velocity layers such as the weathered layer near the Earth's surface.",Geophysics,https://glossary.slb.com/en/terms/d/differential_weathering_correction
diffraction,"[Geophysics] A type of event produced by the radial scattering of a wave into new wavefronts after the wave meets a discontinuity such as a fault surface, an unconformity or an abrupt change in rock type. Diffractions appear as hyperbolic or umbrella-shaped events on a seismic profile. Proper migration of seismic data makes use of diffracted energy to properly position reflections.",Geophysics,https://glossary.slb.com/en/terms/d/diffraction
diffraction stack,"[Geophysics] Also known as Kirchhoff migration, a method of seismic migration that uses the integral form (Kirchhoff equation) of the wave equation. All methods of seismic migration involve the backpropagation (or continuation) of the seismic wavefield from the region where it was measured (Earth's surface or along a borehole) into the region to be imaged. In Kirchhoff migration, this is done by using the Kirchhoff integral representation of a field at a given point as a (weighted) superposition of waves propagating from adjacent points and times. Continuation of the wavefield requires a background model of seismic velocity, which is usually a model of constant or smoothly varying velocity. Because of the integral form of Kirchhoff migration, its implementation reduces to stacking the data along curves that trace the arrival time of energy scattered by image points in the earth.",Geophysics,https://glossary.slb.com/en/terms/d/diffraction_stack
diffusion,"1. (n.) [Geophysics] The movement of ions or molecules from regions of high concentration to low concentration within a solution. | 2. (n.) [Geophysics] The conduction of heat by the movement of molecules. | 3. (n.) [Formation Evaluation, Enhanced Oil Recovery] The process by which particles move over time within a material due to their kinetic motion. The term is most commonly used in pulsed neutron capture logging and in nuclear magnetic resonance (NMR) logging. In a pulsed neutron capture log, the term refers to the spread of neutrons away from the neutron generator. In NMR logging, diffusion refers to the movement of gas, oil, or water molecules within the pore space.","Formation Evaluation, Enhanced Oil Recovery; Geophysics",https://glossary.slb.com/en/terms/d/diffusion
diffusion equation,"1. (n.) [Geophysics] A partial differential equation describing the variation in space and time of a physical quantity that is governed by diffusion. The diffusion equation provides a good mathematical model for the variation of temperature through conduction of heat and the propagation of electromagnetic waves in a highly conducting medium. The diffusion equation is a parabolic partial differential equation whose characteristic form relates the first partial derivative of a field with respect to time to its second partial derivatives with respect to spatial coordinates. It is closely related to the wave equation. ∇2E = j ω μ σ E, where E = electrical field ω = angular frequency μ = magnetic permeability σ = electrical conductivity ∇ = vector differential operator. | 2. (n.) [Well Testing] A fundamental differential equation obtained by combining the continuity equation, flow law and equation of state. Most of the mathematics of well testing were derived from solutions of this equation, which was originally developed for the study of heat transfer. Fluid flow through porous media is directly analogous to flow of heat through solids. Solutions used in well testing usually assume radial flow and homogenous, isotropic formations.",Geophysics; Well Testing,https://glossary.slb.com/en/terms/d/diffusion_equation
dilatancy,"[Geophysics] The increase in the volume of rocks as a result of deformation, such as when fractures develop.",Geophysics,https://glossary.slb.com/en/terms/d/dilatancy
dilatancy theory,"[Geophysics] A possible explanation for volume changes in rocks due to strain, such as microfracturing or cracking, and the accompanying change in the ratio of P- to S-wave velocity. Support for dilatancy theory comes in the form of porosity increases from 20 to 40% that have been measured in laboratory experiments using rock samples.",Geophysics,https://glossary.slb.com/en/terms/d/dilatancy_theory
dilatation,"1. (n.) [Geophysics] The process of changing volume as stress is applied to a body. | 2. (n.) [Geophysics] The volumetric strain produced by applying stress to a body. | 3. (n.) [Geophysics] A rarefaction, or decrease in pressure and density of a medium as molecules are displaced by a P-wave. As P-waves pass through the Earth, the Earth undergoes compression and expansion. These changes in volume contribute to the positive and negative amplitudes of a seismic trace.",Geophysics,https://glossary.slb.com/en/terms/d/dilatation
dilatational wave,"[Geophysics] An elastic body wave or sound wave in which particles oscillate in the direction the wave propagates. P-waves are the waves studied in conventional seismic data. P-waves incident on an interface at other than normal incidence can produce reflected and transmitted S-waves, in that case known as converted waves.",Geophysics,https://glossary.slb.com/en/terms/d/dilatational_wave
dim spot,"[Geophysics] A type of local seismic event that, in contrast to a bright spot, shows weak rather than strong amplitude. The weak amplitude might correlate with hydrocarbons that reduce the contrast in acoustic impedance between the reservoir and the overlying rock, or might be related to a stratigraphic change that reduces acoustic impedance. Antonyms: bright spot",Geophysics,https://glossary.slb.com/en/terms/d/dim_spot
dip moveout,"1. (n.) [Geophysics] The difference in the arrival times or traveltimes of a reflected wave, measured by receivers at two different offset locations, that is produced when reflectors dip. Seismic processing compensates for DMO. | 2. (n.) [Geophysics] The procedure in seismic processing that compensates for the effects of a dipping reflector. DMO processing was developed in the early 1980s.",Geophysics,https://glossary.slb.com/en/terms/d/dip_moveout
dipole,"1. (n.) [Geophysics] A pair of opposite (and equal) electrical charges. The strength of the dipole is a vector quantity whose direction points from the positive to the negative charge and whose magnitude is the product of the absolute value of the charge times the separation. A point dipole is an idealized mathematical representation of a dipole in which the separation of the charges goes to zero while their charge increases so that the product (dipole strength) remains constant. | 2. (n.) [Geophysics] Two poles of opposite polarity that can generate a field, such as an electric or magnetic field or a dipole source and dipole receiver used in sonic logging for excitation and detection of shear waves. | 3. (n.) [Geophysics] A small antenna used in electromagnetic surveying that can be represented mathematically as a dipole.",Geophysics,https://glossary.slb.com/en/terms/d/dipole
dipole field,[Geophysics] The primary contribution to Earth’s main magnetic field.,Geophysics,https://glossary.slb.com/en/terms/d/dipole_field
directivity,"[Geophysics] The property of some seismic sources whereby the amplitude, frequency, velocity or other property of the resulting seismic waves varies with direction. A directional charge, such as a length of primer cord or a linear array of charges, can be used when directivity is desirable. Directivity is also a property of geophone arrays, air guns, explosives or vibrators, which can be positioned to reduce horizontal traveling noise such as ground roll. Receivers in the form of groups in which the individual geophones or hydrophones are separated from each other in linear (1D) or areal (2D) arrays are directional, and are designed to suppress signal arriving nearly horizontally and to pass nearly vertical arrivals with minimum attenuation or distortion. Directivity is often present, but the difficulty in accounting for it during seismic processing makes it undesirable in most cases.",Geophysics,https://glossary.slb.com/en/terms/d/directivity
discontinuity,"[Geophysics] A subsurface boundary or interface at which a physical quantity, such as the velocity of transmission of seismic waves, changes abruptly. The velocity of P-waves increases dramatically (from about 6.5 to 8.0 km/s) at the Mohorovicic discontinuity between the Earth's crust and mantle.",Geophysics,https://glossary.slb.com/en/terms/d/discontinuity
dispersion,"1. (n.) [Geophysics] A type of distortion of a wave train in which the velocity of the wave varies with frequency. Surface waves and electromagnetic body waves typically exhibit dispersion, whereas P-waves in most rocks show little change in velocity with frequency. | 2. (n.) [Geophysics] The phenomenon of a wave separating into its frequency constituents as it passes through a medium. Each frequency component travels at its phase velocity (vp), which is the product of the frequency (f) and wavelength (λ) of that component. Angular dispersion results from anisotropy, which causes velocity to vary with direction. Dispersion affects all types of waves, including light, electromagnetic, sound, elastic, gravity, and water waves. | 3. (n.) [Drilling Fluids] The act of breaking up large particles into smaller ones and distributing them throughout a liquid or gaseous medium. For example, in water-base drilling mud, dispersion is the act of degrading clay materials, starches, carboxymethylcellulose, biopolymer, synthetic polymers, or oils into submicroscopic particles by applying mechanical energy, heat, or chemical means. In oil-mud emulsion terminology, dispersion is the act of forming a fine-grained emulsion of an aqueous phase into an oil. This is usually accomplished with by mechanical shearing or heating in the presence of surfactants. It also includes dispersing solids into an oil mud, such as barite or organophilic clays. Mud viscosity increases as more and more platelets are dispersed. No gel structure can form as long as mechanical shearing is in progress. | 4. (n.) [Drilling Fluids] A colloidal system, such as a drilling fluid, that has been dispersed. More generally, the term applies to any two (or more) phase system in which one phase exists as small particles or droplets dispersed in the second phase. | 5. (n.) [Enhanced Oil Recovery] Spatial separation of components within a fluid. This separation is often driven by diffusion, mixing, or differential flow. In an oil field, components might be separated because of heterogeneity of permeability, or simply because of different paths taken by the fluid through the pore structure. Hydrodynamic dispersion includes both of these mechanical effects and molecular diffusion. The components of an enhanced oil recovery formulation can also be dispersed within a porous rock via differential adsorption properties (chromatographic effects).",Drilling Fluids; Enhanced Oil Recovery; Geophysics,https://glossary.slb.com/en/terms/d/dispersion
displacement,"1. (n.) [Geology] The offset of segments or points that were once continuous or adjacent. Layers of rock that have been moved by the action of faults show displacement on either side of the fault surface. | 2. (n.) [Geophysics] The movement of a particle by wave action, such as movement of rock grains when a seismic wave shakes the ground. | 3. (n.) [Geophysics] The horizontal distance between a seismic refraction depth point and the geophone where refracted energy or refraction signal was recorded. | 4. (n.) [Drilling] The shortest distance from the surface location of a well to the vertical projection of the bottom of the well (or other point in the well) to the Earth's surface. Horizontal wells often have total displacements of 1000 ft [305 m] or more from the surface location, and the world record exceeds 10 km [6.2 miles] of displacement. | 5. (n.) [Drilling] The act of removing one fluid (usually liquid) from a wellbore and replacing it with another. This is accomplished by pumping a spacer fluid that is benign to both the first and second fluid, followed by the new fluid, down the drillstring and out the bottom of the drillstring or bit. While the spacer and second fluid are pumped into the top of the wellbore, the first fluid is forced out of the annulus between the drillstring and the wellbore or casing. In some cases, this general procedure may be reversed by pumping in the top of the annulus and taking fluid back from the drillstring. Since this is the reverse of the normal circulation path, this is referred to as ""reversing out"" or ""reverse circulation."" | 6. (n.) [Drilling] The act of forcing a cement slurry that has been pumped into a casing string or drillstring to exit the bottom of the casing or drillstring by pumping another fluid behind it. Cement displacement is similar to definition 5 above, with the noted exception that the cement slurry would not normally be pumped out the top of the annulus, but would instead be placed in a particular location in the annulus. This location might be the entire annulus on a short casing string, or filling only a bottom portion of the casing on longer casing strings.",Drilling; Geology; Geophysics,https://glossary.slb.com/en/terms/d/displacement
distortion,"1. (n.) [Geophysics] The inability of a system to exactly match input and output, a general example being an electronic amplifier and the classic example being a home stereophonic amplifier. | 2. (n.) [Geophysics] A change in a waveform that is generally undesirable, such as in seismic waves.",Geophysics,https://glossary.slb.com/en/terms/d/distortion
diurnal variation,"[Geophysics] The daily variation in properties of the Earth, such as the temperature or the local geomagnetic field, or the daily change in sunlight. Such variations depend in part on latitude, proximity to the ocean, the effects of solar radiation and tides and other factors.",Geophysics,https://glossary.slb.com/en/terms/d/diurnal_variation
divergence,"1. (n.) [Geophysics] The loss of energy from a wavefront as a consequence of geometrical spreading, observable as a decrease in wave amplitude. Spherical divergence decreases energy with the square of the distance. Cylindrical divergence decreases energy with the distance. | 2. (n.) [Geophysics] In mathematics, a process in which a sequence of numbers does not tend to a fixed limit (the opposite of convergence). Divergence is a mathematical property of a vector field that is a local measure of its rate of spreading. Antonyms: convergence | 3. (n.) [Geophysics] In Cartesian coordinates, divergence is the sum of the partial derivatives of each component of the vector field with respect to the corresponding spatial coordinate: div V = ∇·V = ∂Vx/∂x + ∂Vy/∂y + ∂Vz/∂z",Geophysics,https://glossary.slb.com/en/terms/d/divergence
Dix formula,"[Geophysics] An equation used to calculate the interval velocity within a series of flat, parallel layers, named for American geophysicist C. Hewitt Dix (1905 to 1984). Sheriff (1991) cautions that the equation is misused in situations that do not match Dix's assumptions. The equation is as follows: Vint = [(t2 VRMS22 − t1 VRMS12) / (t2 − t1)]1/2, where Vint = interval velocity t1 = traveltime to the first reflector t2 = traveltime to the second reflector VRMS1 = root-mean-square velocity to the first reflector VRMS2 = root-mean-square velocity to the second reflector. Reference: Dix CH: ""Seismic Velocities from Surface Measurements,"" Geophysics 20, no. 1 (January 1955): 68–86.",Geophysics,https://glossary.slb.com/en/terms/d/dix_formula
DMO,"[Geophysics] The difference in the arrival times or traveltimes of a reflected wave, measured by receivers at two different offset locations, that is produced when reflectors dip. Seismic processing compensates for DMO.",Geophysics,https://glossary.slb.com/en/terms/d/dmo
