term,definition,disciplines,url
image,"1. (n.) [Geophysics] The apparent source of a received wave. The image is the point in the subsurface that the rays would appear to have come from if they were not reflected, but were shot up from below. A ray that travels from a source and is reflected to a geophone has the same appearance as a ray that travels straight from the image and up to the geophone. | 2. (n.) [Geophysics] A representation that depicts the subsurface in two or more dimensions. | 3. (vb.) [Geophysics] In remote sensing, to record and interpret electromagnetic energy from the surfaces of planets or satellites using photographic displays.",Geophysics,https://glossary.slb.com/en/terms/i/image
impedance,"1. (n.) [Geophysics] In acoustics, the product of velocity times density, also called acoustic impedance and symbolized by Z. The reflection coefficient of an interface depends on the contrast in acoustic impedance of the rock on either side of the interface. | 2. (n.) [Geophysics] In electromagnetics or electrical circuit theory, the ratio of voltage to current when these are represented by phasor quantities in alternating current circuits. (A phasor is a complex number that represents the amplitude and phase of a quantity that varies sinusoidally in time.) Electrical impedance, also symbolized by Z, is a complex number that has the same units (ohms) as resistivity.",Geophysics,https://glossary.slb.com/en/terms/i/impedance
impulsive seismic data,"[Geophysics] Seismic data whose energy source is impulsive and of short duration, as with an air gun, rather than vibratory, as with a vibrator.",Geophysics,https://glossary.slb.com/en/terms/i/impulsive_seismic_data
in line,"[Geophysics] A seismic line within a 3D survey parallel to the direction in which the data were acquired. In marine seismic data, the in-line direction is that in which the recording vessel tows the streamers.",Geophysics,https://glossary.slb.com/en/terms/i/in_line
in-line,"[Geophysics] A seismic line within a 3D survey parallel to the direction in which the data were acquired. In marine seismic data, the in-line direction is that in which the recording vessel tows the streamers.",Geophysics,https://glossary.slb.com/en/terms/i/in-line
incident angle,"[Geophysics] The acute angle at which a raypath impinges upon a line normal to an interface, such as a seismic wave impinging upon strata. Normal incidence is the case in which the angle of incidence is zero, the wavefront is parallel to the surface and its raypath is perpendicular, or normal, to the interface. Snell's law describes the relationship between the angle of incidence and the angle of refraction of a wave.",Geophysics,https://glossary.slb.com/en/terms/i/incident_angle
inclinometer,[Geophysics] An instrument used to measure the dip of the Earth's magnetic field.,Geophysics,https://glossary.slb.com/en/terms/i/inclinometer
induced polarization,"[Geophysics] An electromagnetic method that uses electrodes with time-varying currents and voltages to map the variation of electrical permittivity (dielectric constant) in the Earth at low frequencies. Induced polarization is observed when a steady current through two electrodes in the Earth is shut off: the voltage does not return to zero instantaneously, but rather decays slowly, indicating that charge has been stored in the rocks. This charge, which accumulates mainly at interfaces between clay minerals, is responsible for the IP effect. This effect can be measured in either the time domain by observing the rate of decay of voltage or in the frequency domain by measuring phase shifts between sinusoidal currents and voltages. It is often used in exploration for minerals and can sometimes distinguish different types of mineralization. The IP method can probe to subsurface depths of thousands of meters.",Geophysics,https://glossary.slb.com/en/terms/i/induced_polarization
interpretation,"[Geophysics] In geophysics, analysis of data to generate reasonable models and predictions about the properties and structures of the subsurface. Interpretation of seismic data is the primary concern of geophysicists.",Geophysics,https://glossary.slb.com/en/terms/i/interpretation
interval time,[Geophysics] The elapsed time between two seismic events.,Geophysics,https://glossary.slb.com/en/terms/i/interval_time
interval transit time,"[Geophysics] The amount of time for a wave to travel a certain distance, proportional to the reciprocal of velocity, typically measured in microseconds per foot by an acoustic log and symbolized by t or DT. P-wave interval transit times for common sedimentary rock types range from 43 (dolostone) to 160 (unconsolidated shales) microseconds per foot, and can be distinguished from measurements of steel casing, which has a consistent transit time of 57 microseconds per foot.",Geophysics,https://glossary.slb.com/en/terms/i/interval_transit_time
interval velocity,"[Geophysics] The velocity, typically P-wave velocity, of a specific layer or layers of rock, symbolized by vint and commonly calculated from acoustic logs or from the change in stacking velocity between seismic events on a common midpoint gather.",Geophysics,https://glossary.slb.com/en/terms/i/interval_velocity
interwell tomography,"[Geophysics, Formation Evaluation, Enhanced Oil Recovery] A technique for measuring a signal that is broadcast from a transmitter or source located in one well, to a receiver array placed in a neighboring well. This technique is used to create a display of formation properties such as acoustic velocity and attenuation, seismic reflectivity, or electromagnetic resistivity in the area between wells. The reservoir-scale data acquired with this technique can be used to bridge the gap between wellbore measurements and surface measurements.","Geophysics, Formation Evaluation, Enhanced Oil Recovery",https://glossary.slb.com/en/terms/i/interwell_tomography
inverse problem,"[Geophysics] The problem of determining the value or spatial variation of a physical property or feature by comparing measurements to the predictions of a model. For example, seismic traveltimes from a source to a receiver can be used to build a model of seismic velocity in the Earth, or earthquake arrival times can be used to determine the timing and focus (location) of an earthquake. A typical inverse problem in electromagnetics is to determine the variation of electrical conductivity in the Earth from measurements of induced electric and magnetic fields. A forward problem, in contrast, involves taking an assumed model and calculating what the observed values should be, such as the predicting seismic traveltimes between a source and a receiver given a velocity model.",Geophysics,https://glossary.slb.com/en/terms/i/inverse_problem
inversion,"1. (n.) [Geology] The reversal of features, particularly structural features such as faults, by reactivation. For example, a normal fault might move in a direction opposite to its initial movement. | 2. (n.) [Geology] The atypical appearance of structural and topographic features, such as an anticline being exposed in a valley instead of as a hill; also called inverted relief. | 3. (n.) [Geophysics] A mathematical process by which data are used to generate a model that is consistent with the data, the process of solving the inverse problem. In seismology, surface seismic data, vertical seismic profiles and well log data can be used to perform inversion, the result of which is a model of Earth layers and their thickness, density and P- and S-wave velocities. Successful seismic inversion usually requires a high signal-to-noise ratio and a large bandwidth.",Geology; Geophysics,https://glossary.slb.com/en/terms/i/inversion
IP,"1. (n.) [Geophysics] An electromagnetic method that uses electrodes with time-varying currents and voltages to map the variation of electrical permittivity (dielectric constant) in the Earth at low frequencies. Induced polarization is observed when a steady current through two electrodes in the Earth is shut off: the voltage does not return to zero instantaneously, but rather decays slowly, indicating that charge has been stored in the rocks. This charge, which accumulates mainly at interfaces between clay minerals, is responsible for the IP effect. This effect can be measured in either the time domain by observing the rate of decay of voltage or in the frequency domain by measuring phase shifts between sinusoidal currents and voltages. It is often used in exploration for minerals and can sometimes distinguish different types of mineralization. The IP method can probe to subsurface depths of thousands of meters | 2. (n.) [Drilling Fluids] Abbreviation for the Institute of Petroleum, a standardization body for the petroleum industry in Europe. Several industry-standard drilling-fluid tests are adopted from IP and ASTM procedures.",Drilling Fluids; Geophysics,https://glossary.slb.com/en/terms/i/ip
isochron,"[Geophysics] A line joining points of equal time or age, such as a reflection in a seismic profile or contours in an isochron map.",Geophysics,https://glossary.slb.com/en/terms/i/isochron
isochron map,1. (n.) [Geophysics] A contour map that displays the variation in time between two seismic events or reflections. | 2. (n.) [Geophysics] A contour map showing the traveltimes to one particular seismic event or reflection.,Geophysics,https://glossary.slb.com/en/terms/i/isochron_map
isostatic correction,[Geophysics] A correction for variations in the density or thickness of the Earth's crust. Isostatic corrections are commonly applied to gravity data and are made according to a specific model for isostasy.,Geophysics,https://glossary.slb.com/en/terms/i/isostatic_correction
jug,[Geophysics] Archaic slang for a geophone.,Geophysics,https://glossary.slb.com/en/terms/j/jug
jug hustler,[Geophysics] Slang term for a member of a seismic acquisition crew or party who lays out cables and plants geophones for seismic acquisition and collects them after surveying.,Geophysics,https://glossary.slb.com/en/terms/j/jug_hustler
Kirchhoff equation,[Geophysics] A mathematical representation of the principle that a wavefield at a given point in space and time can be considered as the superposition of waves propagating from adjacent points and earlier times. It is an integral form of the wave equation in which the wave function at a point is represented as the sum (integral) of contributions from a surface enclosing the given point. The Kirchhoff equation (also called the Kirchhoff integral) is the basis for Kirchhoff migration.,Geophysics,https://glossary.slb.com/en/terms/k/kirchhoff_equation
Kirchhoff migration,"[Geophysics] A method of seismic migration that uses the integral form (Kirchhoff equation) of the wave equation. All methods of seismic migration involve the backpropagation (or continuation) of the seismic wavefield from the region where it was measured (Earth's surface or along a borehole) into the region to be imaged. In Kirchhoff migration, this is done by using the Kirchhoff integral representation of a field at a given point as a (weighted) superposition of waves propagating from adjacent points and times. Continuation of the wavefield requires a background model of seismic velocity, which is usually a model of constant or smoothly varying velocity. Because of the integral form of Kirchhoff migration, its implementation reduces to stacking the data along curves that trace the arrival time of energy scattered by image points in the earth.",Geophysics,https://glossary.slb.com/en/terms/k/kirchhoff_migration
kriging,"[Geophysics] A statistical technique used with variograms, or two-point statistical functions that describe the increasing difference or decreasing correlation between sample values as separation between them increases, to determine the value of a point in a heterogeneous grid from known values nearby.",Geophysics,https://glossary.slb.com/en/terms/k/kriging
lag,"1. (n.) [Geophysics] The delay or difference in the arrival time of seismic events that can result from weathering of the rocks or variations in geologic structures in the subsurface. | 2. (n.) [Geophysics] A term used in seismic processing to describe the interval between the zero-time of a crosscorrelation between two traces and the point of maximum correlation. | 3. (n.) [Geophysics] The time delay of the onset of one sinusoidal oscillation, or frequency component of a trace, relative to another. Also known as a ""phase-lag."" | 4. (n.) [Formation Evaluation] The distance between the static measure point and the dynamic measure point of a logging measurement. For nuclear logs and any others that must be recorded over a significant time period, there is a difference between the measure point with the tool stationary and moving. If the tool is moving during this period, the effective center of measurement will be a certain distance from the point at which the measurement started. This distance is the lag. The lag depends on the logging speed and the sampling interval.",Formation Evaluation; Geophysics,https://glossary.slb.com/en/terms/l/lag
Lam&eacute; constant,"[Geophysics] One of two elastic constants named for French mathematician Gabriel Lamé (1795 to 1870). The first Lamé constant is λ, the bulk modulus (K) less two-thirds of the shear modulus (μ): λ = K − (2/3)μ The second Lamé constant is the shear modulus (μ): μ = τ / γ = (ΔF/A) / (ΔL/L), where μ = Shear modulus τ = Shear stress = ΔF/A ΔF = Increment of shear force A = Area acted on by the shear force γ = Shear strain = ΔL/L ΔL = Increment of transverse displacement parallel to A L = Original length. Lamé constants derived from elastic-wave velocities: λ = ρ(VP2 − 2VS2) μ = ρVS2 λ/μ = (VP/VS)2 − 2, where λ = Lamé's first constant μ = Lamé's second constant, the shear modulus VP = Compressional-wave (P-wave) velocity VS = Shear-wave (S-wave) velocity ρ = Density.",Geophysics,https://glossary.slb.com/en/terms/l/lame_constant
Laplace equation,"[Geophysics] A partial differential equation that governs potential fields (in regions where there are no sources) and is equivalent, in three dimensions, to the inverse square law of gravitational or electrical attraction. In Cartesian coordinates, the Laplace equation equates the sum of the second partial (spatial) derivatives of the field to zero. (When a source is present, this sum is equal to the strength of the source and the resulting equation is called Poisson's equation). The differential equation is named for French mathematician Pierre-Simon de Laplace (1749 to 1827), and applies to electrical, gravity and magnetic fields. ∇2u = ∂2u/∂x2 + ∂2u/∂y2 + ∂2u/∂z2 = 0, where u(x,y,z) is a potential function.",Geophysics,https://glossary.slb.com/en/terms/l/laplace_equation
layer stripping,[Geophysics] A method of seismic inversion whereby the effects of rock layers having different seismic characteristics are removed from layers below.,Geophysics,https://glossary.slb.com/en/terms/l/layer_stripping
least-time path,"[Geophysics] The fastest route that a seismic ray can travel between two points, generally dictated by Fermat's principle.",Geophysics,https://glossary.slb.com/en/terms/l/least-time_path
lithostratigraphic inversion,[Geophysics] A seismic inversion technique that attempts to describe lithology of individual rock layers and evaluate properties and distribution of pore fluids through analysis of variation of reflected seismic amplitude with offset.,Geophysics,https://glossary.slb.com/en/terms/l/lithostratigraphic_inversion
local magnetic interference,[Geophysics] Magnetic interference caused by nearby structures such as metallic rigs and wells. The magnetic permeability of drillstrings and the remanent magnetization in drillstrings contribute to perturbations of the measured magnetic field. Operators may use nonmagnetic drill collars to reduce these effects along with software techniques to compensate for them.,Geophysics,https://glossary.slb.com/en/terms/l/local_magnetic_interference
long path multiple,[Geophysics] A type of multiply-reflected seismic energy that appears as an event. Long-path multiples generate distinct events because their travel path is much longer than primary reflections giving rise to them. They typically can be removed by seismic processing.,Geophysics,https://glossary.slb.com/en/terms/l/long_path_multiple
long-path multiple,[Geophysics] A type of multiply-reflected seismic energy that appears as an event. Long-path multiples generate distinct events because their travel path is much longer than primary reflections giving rise to them. They typically can be removed by seismic processing.,Geophysics,https://glossary.slb.com/en/terms/l/long-path_multiple
Love wave,[Geophysics] A type of surface wave in which particles oscillate horizontally and perpendicularly to the direction of wave propagation.,Geophysics,https://glossary.slb.com/en/terms/l/love_wave
low velocity layer,"[Geophysics, Geology] Also known as weathered layer, a near-surface, possibly unconsolidated layer of low seismic velocity. The base of the weathered layer commonly coincides with the water table and a sharp increase in seismic velocity. The weathered layer typically has air-filled pores.","Geophysics, Geology",https://glossary.slb.com/en/terms/l/low_velocity_layer
low-velocity layer,"[Geology, Geophysics] Also known as weathered layer, a near-surface, possibly unconsolidated layer of low seismic velocity. The base of the weathered layer commonly coincides with the water table and a sharp increase in seismic velocity. The weathered layer typically has air-filled pores.","Geology, Geophysics",https://glossary.slb.com/en/terms/l/low-velocity_layer
magnetic constant,"[Geophysics] Another term for magnetic permeability, the ratio of the density of the magnetic flux, B (in units of teslas), to the strength of the magnetic field, H (in units of amperes/meter), typically expressed in units of H/m.",Geophysics,https://glossary.slb.com/en/terms/m/magnetic_constant
magnetic field,"[Geophysics] The magnetic field measured near the Earth’s surface is the superposition of magnetic fields arising from various time-varying physical processes that are grouped into four general components: the main magnetic field the crustal field external disturbance field local magnetic interference. The significance of these contributions to direction, strength and stability of the magnetic field varies with geographic region and with magnetic survey direction.",Geophysics,https://glossary.slb.com/en/terms/m/magnetic_field
magnetic permeability,"[Geophysics] The ratio of the density of the magnetic flux, B (in units of teslas), to the strength of the magnetic field, H (in units of amperes/meter), typically expressed in units of henries per meter (H/m).",Geophysics,https://glossary.slb.com/en/terms/m/magnetic_permeability
magnetic total field,"[Geophysics] The modulus of the magnetic field vector. The magnetic total field is the magnitude, or absolute value, of the magnetic field vector. The magnetic total field describes the strength, or intensity, of the magnetic field, which is measured in units of nanoTesla (nT). The symbol for the magnetic total field is often F or Btotal.",Geophysics,https://glossary.slb.com/en/terms/m/magnetic_total_field
magnetics,"[Geophysics] The study of the Earth's magnetic field, a branch of geophysics that began with the observation by British scientist William Gilbert (1544 to 1603) that the Earth is a magnet. Variations in the magnetic field can be used to determine the extent of sedimentary basins and the depth to basement rocks, as well as to differentiate between igneous rocks and certain sedimentary rocks such as salt. High-resolution magnetic surveys can also be used to determine the locations of oil pipelines and production equipment.",Geophysics,https://glossary.slb.com/en/terms/m/magnetics
magnetometer,[Geophysics] An instrument used to measure the strength or direction of the Earth's magnetic field.,Geophysics,https://glossary.slb.com/en/terms/m/magnetometer
magnetotelluric method,"[Geophysics] An electromagnetic method used to map the spatial variation of the Earth's resistivity by measuring naturally occurring electric and magnetic fields at the Earth's surface. These natural EM fields are generated (at all frequencies) in the Earth's atmosphere mainly by lightning strokes and by interactions between the solar wind and the ionosphere. In the most general MT method, the horizontal components of the electric field and all three components of the magnetic field are measured at the surface. The measurements are used to determine specific ratios of electric to magnetic field components called tensor impedances. The technique was introduced the French geophysicist Louis Cagniard in the 1950s and has been popular for mineral exploration and regional geophysical mapping. It is used in oil exploration for low-cost reconnaissance of sedimentary basins and for exploration in areas where seismic surveys are difficult because of severe topography or the presence high-impedance volcanic rocks near the surface. The resolution of MT surveys is limited by the diffusive nature of EM propagation in the earth; it is usually on the order of hundreds of meters to kilometers. But the MT method can probe the Earth to depths of several tens of kilometers.",Geophysics,https://glossary.slb.com/en/terms/m/magnetotelluric_method
main magnetic field,"[Geophysics] Earth’s main magnetic field generated in the Earth’s fluid outer core by a self-exciting dynamo process. Approximately 95% of the total magnetic field measured at Earth’s surface comes from this main field, a significant portion of which may be described as the field of a dipole placed at the Earth’s center and tilted approximately 11° from the Earth’s rotational axis. The magnitude of the main magnetic field is nearly 60,000 nT near the Earth’s poles and about 30,000 nT near the equator. However, there are significant nondipole contributions to the main magnetic field that complicate its mathematical and graphical representation, including that the relative strengths of nondipole components change. As additional complications, the main field varies slowly because of changes within the Earth’s core and the magnetic dipole axis pole position itself wanders over time.",Geophysics,https://glossary.slb.com/en/terms/m/main_magnetic_field
marker bed,"[Geophysics] A widespread distinctive rock unit that can be correlated readily over a large area. The most useful marker beds tend to form rapidly, such as during volcanic or geologically instantaneous depositional events, and have unusual seismic, magnetic, electrical or other physical properties that aid geological or geophysical interpretation. Coal beds and volcanic ash falls are examples of marker beds.",Geophysics,https://glossary.slb.com/en/terms/m/marker_bed
Maxwell's equations,"[Geophysics] A group of four partial differential equations that describe all classical phenomena, involving electric and magnetic fields. James Clerk Maxwell (1831 to 1879), a British physicist, first wrote out this complete set of equations: (1.) ∇·D = ρ (2.) ∇×H = J + (∂D/∂t) (3.) ∇·B = 0 (4.) ∇×E = −(∂B/∂t), where D = electric displacement ρ = electric charge density H = magnetic field strength J = electric current density B = magnetic flux density E = electric field strength. Equation (1) is equivalent to Coulomb's law, the inverse square attraction of static electric charges. Equation (2) is Ampere's law relating magnetic fields and currents, which was extended by Maxwell to include induction of a magnetic field by a time-varying electric displacement. Equation (3) is Coulomb's law for magnetic flux, expressing the absence of isolated magnetic charges. Equation (4) is Faraday's law of induction, relating an electric field to a time-varying magnetic flux. Maxwell's equations are the starting point for all calculations involving surface or borehole EM methods.",Geophysics,https://glossary.slb.com/en/terms/m/maxwells_equations
midpoint,[Geophysics] The halfway point between a seismic source and a receiver at the Earth's surface.,Geophysics,https://glossary.slb.com/en/terms/m/midpoint
migrate,"1. (vb.) [Geology] For hydrocarbons to move from their source into reservoir rocks. The movement of newly generated hydrocarbons out of their source rock is primary migration, also called expulsion. The further movement of the hydrocarbons into reservoir rock in a hydrocarbon trap or other area of accumulation is secondary migration. Migration typically occurs from a structurally low area to a higher area because of the relative buoyancy of hydrocarbons in comparison to the surrounding rock. Migration can be local or can occur along distances of hundreds of kilometers in large sedimentary basins, and is critical to the formation of a viable petroleum system. | 2. (vb.) [Geophysics] To execute a step in seismic processing in which reflections in seismic data are moved to their correct locations in x-y-time space of seismic data. Migration improves seismic interpretation and mapping because the locations of geological structures, especially faults, are more accurate in migrated seismic data. Proper migration collapses diffractions from secondary sources such as reflector terminations against faults and corrects bow ties to form synclines. There are numerous methods of migration, such as dip moveout (DMO), frequency domain, ray-trace and wave-equation migration.",Geology; Geophysics,https://glossary.slb.com/en/terms/m/migrate
